Nick Novak,Novak is on injured reserve due to a back injury.,Back,I-R,LAC,K
Chris Landrum,Landrum is on the injured reserve list with a shoulder injury.,Shoulder,I-R,LAC,DE
Charmeachealle Moore,Moore has been designated for injured reserve with an unspecified injury.,Undisclosed,I-R,LAC,LB
Asante Cleveland,Cleveland has been placed on injured reserve due to a right knee injury.,Knee,I-R,LAC,TE
Dewey McDonald,McDonald tore his ACL in his knee and is on the injured reserve list.,Knee,I-R,SEA,LB
DeAndre Elliott,Elliott has a right ankle injury and is on the injured reserve list.,Ankle,I-R,SEA,CB
George Fant,Fant suffered a torn ACL in his right knee and is on the injured reserve list.,Knee,I-R,SEA,T
Cliff Avril,Avril sustained a neck injury causing numbness down his arm and is on the injured reserve list.,Neck,I-R,SEA,DE
Malik McDowell,McDowell is on the Injured Reserve/Non-Football Injury list with a concussion and facial fractures.,Concussion,I-R,SEA,DT
Kam Chancellor,Chancellor is expected to miss the remainder of the season after suffering a neck injury.,Neck,out,SEA,S
C.J. Prosise,Prosise has been placed on injured reserve with a sprained left ankle and will be eligible to return during the postseason.,Ankle,I-R,SEA,RB
Richard Sherman,Sherman suffered a ruptured right Achilles tendon and is on the injured reserve list.,Achilles,I-R,SEA,CB
Rees Odhiambo,Odhiambo is dealing with injuries to both hands and is on the injured reserve list.,Hand,I-R,SEA,G
Tre Madden,"Madden has been placed on injured reserve with a calf injury, ending his season.",Calf,I-R,SEA,FB
Dion Jordan,Jordan has sat out the previous three games due to a neck injury and it is unclear if he will participate in Week 15 against the Rams.,Neck,questionable,SEA,DE
Chris Carson,Carson has landed on the injured reserve list due to a fracture just below his left knee and also has a high-ankle sprain. It is uncertain if he will return Week 15 against the Rams.,Knee,I-R,SEA,RB
K.J. Wright,Wright was lifted from the last game due to a concussion and it is uncertain if he will pass protocol in time for Week 15 against the Rams.,Concussion,questionable,SEA,LB
Oday Aboushi,Aboushi has been held out of the past three games due to a dislocated shoulder and it is unknown if he will return against the Rams in Week 15.,Shoulder,questionable,SEA,G
Nazair Jones,Jones has missed the last two games due to an ankle injury and his status for Week 15 against the Rams is undecided.,Ankle,questionable,SEA,DT
Bobby Wagner,Wagner was forced from Sunday's game with a hamstring injury and it is uncertain if he will suit up against the Rams during Week 15.,Hamstring,questionable,SEA,LB
DeShawn Shead,Shead underwent surgery to repair the torn ACL in his left knee and is on the PUP list. It is undetermined if he will be activated in time for Week 15 against the Rams.,Knee,I-R,SEA,CB
Josh Forrest,Forrest has been placed on the injured reserve list with a foot injury.,Foot,I-R,SEA,LB
Don Jones,Jones has been designated for injured reserve with a torn ACL in his left knee.,Knee,I-R,SFO,DB
Chris Jones,Jones is dealing with an unspecified injury and is on injured reserve.,Undisclosed,I-R,SFO,DL
Joshua Garnett,Garnett had a procedure performed on his knee and is on the injured reserve list.,Knee,I-R,SFO,G
Aaron Burbridge,Burbridge has landed on injured reserve with a hamstring injury.,Hamstring,I-R,SFO,WR
Garry Gilliam,Gilliam has landed on the injured reserve list with a knee injury.,Knee,I-R,SFO,OL
Jimmie Ward,Ward suffered a broken forearm and is on the injured reserve list.,Forearm,I-R,SFO,DB
Arik Armstead,Armstead is on injured reserve with a broken hand and it is unclear if he will be activated December 17 against the Titans.,Hand,I-R,SFO,DL
Erik Magnuson,Magnuson has landed on injured reserve with a shoulder injury.,Shoulder,I-R,SFO,OL
Raheem Mostert,Mostert sustained a knee injury and is on injured reserve.,Knee,I-R,SFO,RB
Jaquiski Tartt,Tartt is on the injured reserve list as he suffered a broken forearm.,Forearm,I-R,SFO,S
Cole Hikutini,Hikutini has been placed on the injured reserve list due to a knee injury.,Knee,I-R,SFO,TE
Pierre Garcon,Garcon suffered a neck injury and is on the injured reserve list.,Neck,I-R,SFO,WR
Trenton Brown,Brown sat out the last game with a shoulder injury and his availability for Week 15 against the Titans is in question.,Shoulder,questionable,SFO,OL
Asa Jackson,Jackson has been placed on the injured reserve list with a hamstring injury and it is unknown if he will return for Week 15 against the Titans.,Hamstring,I-R,SFO,CB
Donavin Newsom,Newsom has been diagnosed with a concussion and is on the injured reserve list.,Concussion,I-R,SFO,LB
Chanceller James,James is on injured reserve with a knee injury.,Knee,I-R,SFO,S
Malcolm Smith,Smith sustained a torn pectoral muscle and is on the injured reserve list.,Pectoral,I-R,SFO,LB
Jimmie Gilbert,Gilbert has been placed on injured reserve due to a torn ACL.,Knee,I-R,SFO,LB
DaVonte Lambert,Lambert has been placed on the injured reserve with a dislocated wrist.,Wrist,I-R,TAM,DL
Stevie Tu'ikolovatu,Tu'ikolovatu has been placed on the injured reserve with an injured MCL and meniscus in his right knee.,Knee,I-R,TAM,DT
Noah Spence,Spence is on injured reserve due to a torn labrum in his shoulder.,Shoulder,I-R,TAM,DE
Nick Folk,Folk has been placed on the injured reserve list due to tendinitis in his plant leg.,Leg,I-R,TAM,K
Ali Marpet,Marpet injured his knee and has landed on the injured reserve list.,Knee,I-R,TAM,C
Demar Dotson,Dotson has been placed on the injured reserve list with a knee injury.,Knee,I-R,TAM,T
Gerald McCoy,McCoy suffered a significant biceps injury and there is no timetable for return.,Bicep,out,TAM,DT
Clinton McDonald,McDonald missed his second-straight game with a back injury and it is uncertain if he will be active Week 15 against the Falcons.,Back,questionable,TAM,DT
Joe Hawley,Hawley sat out the previous game with an illness and it is unclear if it will hinder his availability against the Falcons during Week 15.,Illness,questionable,TAM,C
T.J. Ward,Ward has sat out the previous two games with a concussion and it is unknown if he will be cleared in time for Week 15 against the Falcons.,Concussion,questionable,TAM,S
Josh Robinson,Robinson has been held out of the previous two games with a hamstring injury and it is undetermined if he will suit up against the Falcons during Week 15.,Hamstring,questionable,TAM,CB
Vernon Hargreaves,Hargreaves missed his fourth-consecutive game due to a hamstring injury and it is unclear if he will return to the lineup Week 15 against the Falcons.,Hamstring,questionable,TAM,CB
Justin Trattou,Trattou has landed on the injured reserve list with an unspecified ailment.,Undisclosed,I-R,TAM,DE
Su'a Cravens,Cravens had offseason surgery to trim the meniscus in his knee and is on the Injured Reserve/Left Squad list.,Knee,I-R,WAS,S
Phil Taylor,Taylor Sr. has a quadriceps injury and is on the injured reserve list.,Quadricep,I-R,WAS,DL
Mason Foster,Foster has been placed on injured reserve due to a torn labrum in his shoulder.,Shoulder,I-R,WAS,LB
Dustin Hopkins,Hipkins has landed on the injured reserve list due to a right hip rotator muscle sprain.,Hip,I-R,WAS,K
Jonathan Allen,"Allen has been designated for the injured reserve list due to a lisfranc sprain in his foot. He will be eligible to return if activated, December 17 against the Cardinals.",Foot,I-R,WAS,DL
Spencer Long,Long is on the injured reserve list due to a quadriceps tendon injury.,Quadricep,I-R,WAS,C
Chris Thompson,Thompson suffered a fractured right fibula and is on the injured reserve list.,Leg,I-R,WAS,RB
Terrelle Pryor,Pryor Sr. had his ankle scoped and is on the injured reserve list.,Ankle,I-R,WAS,WR
Shawn Lauvao,Lauvao is on injured reserve with a neck injury.,Neck,I-R,WAS,G
T.J. Clemmings,Clemmings is on the injured reserve with an ankle injury.,Ankle,I-R,WAS,T
Robert Kelley,Kelley has landed on the injured reserve list due to a high-ankle sprain and a sprained MCL.,Ankle,I-R,WAS,RB
William Compton,Compton has been placed on the injured reserve list with a Lisfranc sprain in his foot.,Foot,I-R,WAS,LB
Arthur Jones,Jones is on injured reserve with a shoulder injury.,Shoulder,I-R,WAS,DL
Ryan Grant,Grant has an ankle injury and it is undetermined if it will prevent him from suiting up against the Cardinals in Week 15.,Ankle,questionable,WAS,WR
Samaje Perine,Perine was lifted from the last game due to an illness but is likely to play Week 15 against the Cardinals.,Illness,probable,WAS,RB
Chris Carter,Carter will have surgery to fix a fractured fibula and is expected to miss the remainder of the season.,Leg,out,WAS,LB
Chase Roullier,Roullier sat out his third-straight game due to a hand injury and it is undetermined if he will return Week 15 against the Cardinals.,Hand,questionable,WAS,C
Montae Nicholson,Nicholson has not been able to clear concussion protocol prior to the past three games and it is unclear if he will return to action against the Cardinals during Week 15.,Concussion,questionable,WAS,S
Zach Brown,Brown departed the previous game with a foot injury and his availability against the Cardinals in Week 15 is in question.,Foot,questionable,WAS,LB
Terrell McClain,McClain has been held out of the the previous three games with an injured toe and it is uncertain if he will suit up against the Cardinals in Week 15.,Toe,questionable,WAS,DL
Byron Marshall,Marshall departed the previous game with a hamstring injury and it is unknown if he will play against the Cardinals during Week 15.,Hamstring,questionable,WAS,RB
Maurice Harris,Harris missed the previous game due to a concussion and it is uncertain if he will pass protocol in time for Week 15 against the Cardinals.,Concussion,questionable,WAS,WR
Jordan Reed,Reed is out of action due to a hamstring injury and it is unclear as to when he will rejoin the lineup.,Hamstring,out,WAS,TE
Kevin Bowen,Bowen is on injured reserve with a left ankle injury.,Ankle,I-R,WAS,T
Trent Murphy,Murphy suffered an ACL and MLC tear and will spend the entire 2017 season on the injured reserve list.,Knee,I-R,WAS,LB
Keith Marshall,Marshall has been placed on injured reserve after having surgery to repair a torn right patellar tendon.,Knee,I-R,WAS,RB
