Jacquies Smith,Smith is recovering from ACL surgery and his status against the Bears on Sunday is unclear.,Knee,questionable,TAM,DE
Brent Grimes,Grimes sustained a laceration to his lower leg and needed stitches to close the wound but is expected to suit up against the Bears on Sunday.,Leg,probable,TAM,CB
Gerald McCoy,McCoy is nursing a groin injury but is expected to suit up for Sunday's game against the Bears.,Groin,probable,TAM,DT
Ryan Griffin,Griffin has been placed on the injured reserve list due to a sprained AC joint in his shoulder and it is unclear if he will play Week 9 against the Saints.,Shoulder,I-R,TAM,QB
Stevie Tu'ikolovatu,Tu'ikolovatu has been placed on the injured reserve with an injured MCL and meniscus in his right knee.,Knee,I-R,TAM,DT
DaVonte Lambert,Lambert has been placed on the injured reserve with a dislocated wrist.,Wrist,I-R,TAM,DL
Doug Martin,Martin will miss the first three weeks of the 2017 season as his suspension from the end of the 2016 campaign for violating the league's PED policy will carry over.,Suspension,out,TAM,RB
Justin Trattou,Trattou has landed on the injured reserve list with an unspecified ailment.,Undisclosed,I-R,TAM,DE
D.J. Swearinger,Swearinger has a back injury and it is unclear if he will play Sunday against the Rams.,Back,questionable,WAS,S
Josh Doctson,Doctson has tightness in his hamstring and his status against the Rams on Sunday is uncertain.,Hamstring,questionable,WAS,WR
Phil Taylor,Taylor Sr. has a quadriceps injury and is on the injured reserve list.,Quadricep,I-R,WAS,DL
Su'a Cravens,Cravens had offseason surgery to trim the meniscus in his knee and is expected to be sideline for a month.,Knee,out,WAS,S
DeAngelo Hall,Hall is on the PUP list while recuperating from surgery to repair a torn ACL in his knee and it is unclear if he will be activated October 29 against the Cowboys.,Knee,I-R,WAS,S
Kevin Bowen,Bowen is on injured reserve with a left ankle injury.,Ankle,I-R,WAS,T
Trent Murphy,Murphy suffered an ACL and MLC tear and will spend the entire 2017 season on the injured reserve list.,Knee,I-R,WAS,LB
Keith Marshall,Marshall has been placed on injured reserve after having surgery to repair a torn right patellar tendon.,Knee,I-R,WAS,RB
