"Last updated October 09, 2017", , , , , 
LaRoy Reynolds,Reynolds is battling a pectoral injury and is on the injured reserve list. It is uncertain if he will come off of the IR during Week 9 against the Panthers.,Pectoral,I-R,ATL,LB
Ryan Schraeder,Schraeder has sat out the past two games due to a concussion but is likely to return Week 6 against the Dolphins.,Concussion,probable,ATL,T
Julio Jones,Jones left the last contest with an injured hip flexor but is expected to play Week 6 against the Dolphins.,Hip Flexor,probable,ATL,WR
Vic Beasley,Beasley suffered a slight tear in his left hamstring and it is undetermined if he will return Week 6 against the Dolphins.,Hamstring,questionable,ATL,LB
Quincy Mauger,Mauger has been placed on the injured reserve list with a knee injury and it is unclear if he will return November 5 against the Panthers.,Knee,I-R,ATL,S
Jack Crawford,Crawford tore his biceps and is on the injured reserve list.,Bicep,I-R,ATL,DE
Mohamed Sanu,Sanu sustained an injured hamstring and is expected to miss two-to-three weeks as a result.,Hamstring,out,ATL,WR
Terron Ward,Ward missed his second-consecutive game with neck and shoulder injuries. It is undetermined if he will be active against the Dolphins during Week 6.,Neck,questionable,ATL,RB
Ricardo Allen,Allen is currently going through the league-mandated concussion protocol and it is uncertain if he will be cleared in time for Week 6 against the Dolphins.,Concussion,questionable,ATL,S
Courtney Upshaw,Upshaw has been held out of the previous two games with an ankle injury and his availability against the Dolphins in Week 6 is in question.,Ankle,questionable,ATL,DT
Jalen Collins,Collins has been issued a 10-game suspension for violating the NFL's Performance Enhancing Drugs policy but is expected to be available against the Buccaneers on November 26.,Suspension,out,ATL,CB
Charles Clay,Clay had surgery to fix a torn meniscus and sprained MCL. He is likely to miss a month of action.,Knee,out,BUF,TE
Nick O'Leary,O'Leary has a lower-body injury and it is unknown if he will suit up against the Buccaneers in Week 7.,Lower Body,questionable,BUF,TE
Leonard Johnson,Johnson left the last game with a hamstring injury and it is unclear if he will be available for Week 7 against the Buccaneers.,Hamstring,questionable,BUF,CB
E.J. Gaines,Gaines missed the previous game after aggravating a groin injury and his status for Week 7 against the Buccaneers is undetermined.,Groin,questionable,BUF,CB
Colt Anderson,Anderson has been designated for the injured reserve list due to an injured arm and it is unknown if he will be activated December 3 against the Patriots.,Arm,I-R,BUF,S
Jordan Matthews,Matthews requires surgery to repair a thumb injury and is expected to miss at least a month of game action.,Thumb,out,BUF,WR
Ramon Humber,Humber has a broken thumb and there is no timetable for return.,Thumb,out,BUF,LB
Keith Towbridge,Towbridge has been designated for injured reserve with an ankle injury.,Ankle,I-R,BUF,TE
Cole Luke,Luke has been placed on the injured reserve list with an ankle injury and it is unclear if he will return November 13 against the Dolphins.,Ankle,I-R,CAR,CB
Corn Elder,Elder has has been placed on the injured reserve list with a patella stress fracture in his knee.,Knee,I-R,CAR,CB
Dan France,France has been placed on the injured reserve with a concussion.,Concussion,I-R,CAR,T
Teddy Williams,Williams has been placed on the injured reserve with a left arm injury.,Arm,I-R,CAR,CB
Daryl Worley,"Worley is hampered by an ankle injury, leaving his status for Week 6 against the Eagles up in the air.",Ankle,questionable,CAR,CB
Jonathan Stewart,Stewart has an ankle injury and it is unclear if he will play Week 6 against the Eagles.,Ankle,questionable,CAR,RB
Tyler Larsen,Larsen is tending to a shoulder injury and his availability against the Eagles during Week 6 is clouded.,Shoulder,questionable,CAR,C
Matt Kalil,"Kalil is nursing an ankle injury, leaving his status for Week 6 against the Eagles uncertain.",Ankle,questionable,CAR,T
Devin Funchess,Funchess is nursing a knee injury and it is undetermined if he will suit up Week 6 against the Eagles.,Knee,questionable,CAR,WR
Mario Addison,Addison has a knee injury and it is unknown if he will be a participant against the Eagles in Week 6.,Knee,questionable,CAR,DE
Julius Peppers,Peppers is dealing with a shoulder injury and it is undetermined if he will partake in Week 6 against the Eagles.,Shoulder,questionable,CAR,DE
Demetrious Cox,Cox sat out the last game with an ankle injury and his status for Week 6 against the Eagles is undecided.,Ankle,questionable,CAR,S
Ryan Kalil,Kalil has missed the last four games with a neck injury and it is unclear if he will return for Week 6 against the Eagles.,Neck,questionable,CAR,C
Damiere Byrd,Byrd broke his forearm and is on the injured reserve list. It is unclear if he will be activated against Saints on December 3.,Forearm,I-R,CAR,WR
Greg Olsen,Olsen is on injured reserve with a fractured right foot and will be eligible to be activated against the Jets on November 26.,Foot,I-R,CAR,TE
Daeshon Hall,Hall has landed on the injured reserve list with a hand injury. It is unknown if he will be designated for return Week 13 against the Saints.,Knee,I-R,CAR,DE
Kurt Coleman,Coleman left the last contest with a sprained MCL in his knee and likely to miss a month of game action.,Knee,out,CAR,S
Drew Iddings,Iddings has been placed on injured reserve with a shoulder injury.,Shoulder,I-R,CAR,DT
Charles Johnson,Johnson has landed on the injured reserve list as he underwent surgery to repair a back injury.,Back,I-R,CAR,WR
Quintin Demps,Demps is sidelined with a broken left arm and has been placed on injured reserve.,Arm,I-R,CHI,S
Nick Kwiatkoski,Kwiatkoski suffered a pectoral injury and will miss a substantial amount of time.,Pectoral,out,CHI,LB
Kevin White,White suffered a broken shoulder blade and is on the injured reserve list.,Shoulder,I-R,CHI,WR
Patrick Scales,Scales is on the injured reserve list with a torn ACL.,Knee,I-R,CHI,LS
Deiondre' Hall,Hall is incapacitated due to a hamstring injury and it is uncertain if he will be activated against the Packers.,Hamstring,I-R,CHI,DB
Cameron Meredith,Meredith suffered a torn ACL and a slightly torn MCL his left knee. He is on the injured reserve list as a result.,Knee,I-R,CHI,WR
John Timu,Timu exited Monday's game due to a left knee injury and will not return.,Knee,out,CHI,LB
Mark Sanchez,Sanchez missed his second-straight game due to a neck injury and will not be available Monday against the Vikings.,Neck,out,CHI,QB
Kyle Long,Long left Monday's game due to a right ankle injury and his return is unclear.,Ankle,questionable,CHI,G
Hroniss Grasu,Grasu missed the last game with a right hand injury and will not play Monday against the Vikings.,Hand,out,CHI,C
Danny Trevathan,Trevathan has been suspended one game after an illegal hit he committed in the previous game but is expected to return Week 6 against the Ravens.,Suspension,out,CHI,LB
Willie Young,Young is dealing with a torn triceps muscle and is expected to miss the rest of the season.,Tricep,out,CHI,LB
Jerrell Freeman,Freeman has landed on injured reserve with a concussion and a pectoral injury. He will be eligible to be activated against the Packers on November 12.,Concussion,I-R,CHI,LB
Eric Kush,Kush will undergo surgery to fix a torn hamstring and is on the injured reserve list.,Hamstring,I-R,CHI,OL
Jeff Driskel,Driskel has a thumb injury and is on injured reserve. It is unknown if he will be activated against the Jaguars on November 5.,Thumb,I-R,CIN,QB
Mason Schreck,Schreck has a knee injury and is on the injured reserve list.,Knee,I-R,CIN,TE
Tra Carson,Carson has been placed on the injured reserve list with an ankle injury.,Ankle,I-R,CIN,HB
Tyler Boyd,Boyd a sprained MCL in his right knee and is expected to miss multiple weeks of game action.,Knee,out,CIN,WR
John Ross,Ross is sidelined due to a knee injury and is expected to miss an extended period of time.,Knee,out,CIN,WR
Shawn Williams,Williams left the last game with a right elbow injury and it is unknown if he will be available for Week 7 against the Steelers.,Elbow,questionable,CIN,S
Adam Jones,Jones left the last game with a back injury and his status for Week 7 against the Steelers is undetermined.,Back,questionable,CIN,CB
Derron Smith,Smith has missed his last three games with an injured ankle and it is unknown if he will return against the Steelers during Week 7.,Ankle,questionable,CIN,S
Dre Kirkpatrick,Kirkpatrick left the last game with a right shoulder injury and it is unclear if he will play Week 7 against the Steelers.,Shoulder,questionable,CIN,CB
Ryan Hewitt,"Hewitt sat out the previous game with a knee injury and his availability for Week 7 against the Steelers is in question,",Knee,questionable,CIN,HB
Tyler Eifert,Eifert will miss an undetermined amount of time as he is battling back and knee injuries.,Back,out,CIN,TE
Cedric Peerman,Peerman has landed on injured reserve due to a shoulder injury.,Shoulder,I-R,CIN,HB
Corey Coleman,Coleman is on the injured reserve list after having surgery to fix a fractured metacarpal in his right hand and it is unclear if he will be activated November 19 against the Jaguars.,Hand,I-R,CLE,WR
Roderick Johnson,Johnson has been designated for injured reserve with a sprained MCL and meniscus injury.,Knee,I-R,CLE,OL
Howard Wilson,Wilson is on the PUP list due to a fractured kneecap and it is unclear if he will return Week 7 against the Titans.,Knee,I-R,CLE,DB
Jamie Collins,Collins Sr. has missed his last three games with a concussion but is expected to return for Week 6 against the Texans.,Concussion,probable,CLE,LB
Kenny Britt,Britt sat out the last game with knee and groin injuries. It is unclear if he will be available against the Texans in Week 6.,Knee,questionable,CLE,WR
Jordan Leslie,Leslie has been designated for the injured reserve list with a hamstring ailment.,Hamstring,I-R,CLE,WR
Dominique Alexander,Alexander has landed on injured reserve with knee injury and it is undetermined if he will be activated during Week 13 against the Chargers.,Knee,I-R,CLE,LB
Darius Jackson,Jackson has been placed on injured reserve due to a knee injury.,Knee,I-R,CLE,RB
Tank Carder,Carder suffered a torn ACL and is on injured reserve.,Knee,I-R,CLE,LB
Matt McCants,McCants has an ankle injury and is on the injured reserve list.,Ankle,I-R,CLE,OL
Chris Barker,Barker has been placed on the injured reserve list with a ruptured left Achilles.,Achilles,I-R,CLE,OL
Denzelle Good,"Good has landed on injured reserve with a torn ligament in his wrist. If he is designated for return, the earliest he will be eligible to be activated is against the Steelers on November 12.",Wrist,I-R,IND,T
Erik Swoope,Swoope had a knee scope performed and is on the injured reserve list.,Knee,I-R,IND,TE
Edwin Jackson,Jackson has been placed on the injured reserve list due to an undefined ailment.,Undisclosed,I-R,IND,LB
Krishawn Hogan,Hogan tore the ACL in his knee and is on injured reserve.,Knee,I-R,IND,WR
Matt Jones,Jones missed the last game with a knee injury and it it is unclear if it will deter him from suiting up Week 6 against the Titans.,Knee,questionable,IND,RB
Jack Doyle,Doyle was held out of the previous game due to a concussion and it is uncertain if he will pass protocol prior to Week 6 against the Titans.,Concussion,questionable,IND,TE
Anthony Walker,Walker Jr. left the last game with a hamstring injury and his status for Week 6 against the Titans is undecided.,Hamstring,questionable,IND,LB
Chester Rogers,Rogers has been absent from the lineup during the previous five games due to a hamstring injury and it is undetermined if he will make his season debut Week 6 against the Titans.,Hamstring,questionable,IND,WR
Nate Hairston,Hairston sat out the previous game due to a quadriceps injury and it is unknown if he will be available against the Titans in Week 6.,Quadricep,questionable,IND,CB
Quincy Wilson,Wilson has sat out the past three games with a knee injury and it is undetermined if he will be available against the Titans during Week 6.,Knee,questionable,IND,CB
Andrew Luck,Luck is recuperating from surgery to repair a torn labrum in his shoulder and is expected to remain sidelined until at least the start of November.,Shoulder,out,IND,QB
Deyshawn Bond,Bond has been designated for the injured reserve list due to a torn left quadriceps.,Quadricep,I-R,IND,G
Christine Michael,Michael has been designated for the injured reserve list with an injury to an unannounced location.,Undisclosed,I-R,IND,RB
Clayton Geathers,Geathers is on the PUP list as he is recovering from offseason surgery to repair a neck injury and will miss the first six games of the season.,Neck,I-R,IND,S
George Winn,Winn is on the injured reserve list with an ailment to an unannounced location.,Undisclosed,I-R,IND,RB
Mike Iupati,Iupati has landed on injured reserve with an elbow injury and it is undetermined if he will return for Week 12 against the Jaguars.,Tricep,I-R,ARI,G
David Johnson,"Johnson is on injured reserve with a dislocated left wrist. Although he is eligible to return against the Seahawks on November 9, team officials are hoping he returns by Christmas Eve when the team takes on the Giants.",Wrist,I-R,ARI,RB
T.J. Logan,Logan has surgery for a dislocated his wrist and is on the injured reserve list. It is uncertain if he will be activated against the 49ers in Week 9.,Wrist,I-R,ARI,RB
Aaron Brewer,Brewer had surgery to fix a broken hand and will miss an extended length of time.,Hand,out,ARI,LS
Robert Nkemdiche,Nkemdiche sat out his second straight game with a calf injury and it is uncertain if he will be available Week 6 against the Buccaneers.,Calf,questionable,ARI,DL
D.J. Humphries,Humphries aggravated his sprained right knee and his status for Week 6 against the Buccaneers is undecided.,Knee,questionable,ARI,T
Jared Veldheer,Veldheer exited the previous game with a knee injury and it is unknown if he will play against the Buccaneers in Week 6.,Knee,questionable,ARI,T
Corey Peters,Peters was lifted from the previous game due to a knee injury and it is undetermined if he will participate in Week 6 against the Buccaneers.,Knee,questionable,ARI,DL
Alex Boone,Boone is sidelined with a strained pectoral muscle and it is undetermined if he return against the Buccaneers during Week 6.,Pectoral,questionable,ARI,G
Olsen Pierre,Pierre departed the last game due to an ankle injury and his status for Week 6 against the Buccaneers is undetermined.,Ankle,questionable,ARI,DL
Markus Golden,Golden sustained a torn ACL in his knee and is on the injured reserve list.,Knee,I-R,ARI,LB
Ronald Zamort,Zamort has landed on injured reserve due to a torn ACL.,Knee,I-R,ARI,CB
Connor Hamlett,Hamlett has been placed on injured reserve with a broken fibula and his status for Week 9 against the Chiefs is unknown.,Calf,I-R,DAL,TE
Rico Gathers,Gathers is battling a concussion and is on injured reserve. His status for Week 9 against the Chiefs is clouded.,Concussion,I-R,DAL,TE
Duke Thomas,Thomas has been placed on the injured reserve list with a knee injury.,Knee,I-R,DAL,CB
Stephen Paea,Paea missed the last game due to a knee injury and it is unclear if he will play Week 7 against the 49ers.,Knee,questionable,DAL,DT
Nolan Carroll,Carroll has sat out the last three games due to a concussion and it is unknown if he will pass protocol in time for Week 7 against the 49ers.,Concussion,questionable,DAL,CB
Chidobe Awuzie,Awuzie exited the previous game due to a hamstring injury and it is uncertain if he will suit up against the 49ers in Week 7.,Hamstring,questionable,DAL,CB
Charles Tapper,Tapper has landed on injured reserve with a foot injury and it is uncertain if he will return November 30 against the Redskins.,Foot,I-R,DAL,DE
Sean Lee,Lee pulled his hamstring and is expected to need two-to-three weeks to recover.,Hamstring,out,DAL,LB
Zac Dysert,Dysert is on injured reserve due to surgery to repair a herniated disc in his back.,Back,I-R,DAL,QB
Randy Gregory,Gregory is serving a year-long suspension for violations of the league's substance abuse policy.,Suspension,out,DAL,DE
Paxton Lynch,Lynch is dealing with a shoulder injury and there is no timetable for his return.,Shoulder,out,DEN,QB
Jared Crick,Crick is on injured reserve due to a back injury.,Back,I-R,DEN,DE
Carlos Henderson,Henderson is on injured reserve due to a torn left thumb ligament.,Thumb,I-R,DEN,WR
Shane Ray,Ray suffered a torn ligament in his left wrist and is on the injured reserve list. It is unknown if he will be activated against the Eagles in Week 9.,Wrist,I-R,DEN,LB
Jake Butt,Butt has been placed on the Injured Reserve/Non-Football Injury list as he is recovering from offseason surgery to repair a right ACL tear. It is undecided if he will be activated November 5 against the Eagles.,Knee,I-R,DEN,TE
Chad Kelly,Kelly is on the Injured Reserve/Non-Football Injury list while he recovers from a wrist injury and it is unknown if he will return November 5 against the Eagles.,Wrist,I-R,DEN,QB
Cody Latimer,Latimer was held out of the previous game due to a knee injury and it is unclear if he will play Week 6 against the Giants.,Knee,questionable,DEN,WR
Billy Winn,Winn has been placed on the injured reserve due to a torn ACL.,Knee,I-R,DEN,DE
Corey Robinson,Robinson has landed on the injured reserve list with a foot injury and it is uncertain if he will be activated November 12 against the Browns.,Foot,I-R,DET,T
Kasey Redfern,Redfern has been designated for injured reserve as he tore his ACL and MCL and also partially tore the patellar tendon in his knee.,Knee,I-R,DET,P
Matthew Stafford,Stafford has a right ankle injury but is expected to be available against the Saints in Week 7.,Ankle,probable,DET,QB
Kenny Golladay,Golladay has missed the last two games with a hamstring injury and it is unclear if he will be available for Week 6 against the Saints.,Hamstring,questionable,DET,WR
Haloti Ngata,Ngata left the last game with an elbow injury and it is unclear if he will be available for Week 6 against the Saints.,Elbow,questionable,DET,DT
Dwayne Washington,Washington has sat out the previous three games due to a quadriceps injury and it is unclear if he will return for Week 7 against the Saints.,Quadricep,questionable,DET,RB
Joe Dahl,Dahl is on the injured reserve list with a lower-leg injury and it is unclear if he will be activated against the Vikings on November 23.,Leg,I-R,DET,G
Sam Martin,Martin has landed on the Injured Reserve/Non-Football Injury list with an ankle injury and it is unknown if he will return November 6 against the Packers.,Ankle,I-R,DET,P
Paul Worrilow,Worrilow suffered a sprained MCL in his knee that is expected to cost him two-to-four weeks of action.,Knee,out,DET,LB
Zac Kerin,Kerin is on injured reserve with a knee injury.,Knee,I-R,DET,G
Khyri Thornton,Thornton has been issued a six-game suspension by the NFL for violating the league's substance-abuse policy but is expected to be available October 29th against the Steelers.,Suspension,out,DET,DT
Taylor Decker,Decker has landed on the PUP list as he underwent surgery to repair a torn labrum in his shoulder and is expected to miss four-to-six months.,Shoulder,I-R,DET,T
Jordan Hill,Hill has been designated for the injured reserve list due to a biceps injury.,Bicep,I-R,DET,DT
Brandon Copeland,Copeland sustained a torn pectoral muscle and is on the injured reserve list.,Pectoral,I-R,DET,LB
Kerry Hyder,Hyder will have surgery to repair a torn Achilles and is on the injured reserve list.,Achilles,I-R,DET,DE
Mike James,James is on the injured reserve list with a concussion.,Concussion,I-R,DET,RB
Des Lawrence,Lawrence is on injured reserve with an injury to an unannounced location.,Undisclosed,I-R,DET,CB
Brandon Chubb,Chubb is on injured reserve due to a knee injury.,Knee,I-R,DET,LB
Vince Biegel,Biegel is on the PUP list while recuperating from surgery to repair a Jones fracture in his foot and it is undetermined if he will be activated October 22 against the Saints.,Ankle,I-R,GNB,LB
Jordy Nelson,Nelson is expected to play Week 6 against the Vikings despite a hamstring injury.,Hamstring,probable,GNB,WR
Morgan Burnett,Burnett was removed from the last game due to a strained hamstring and it is uncertain if he will play Week 6 against the Vikings.,Hamstring,questionable,GNB,S
Kevin King,King left the previous game to be evaluated for a concussion and it is unknown if he will cleared in time against the Vikings in Week 6.,Concussion,questionable,GNB,CB
Kentrell Brice,Brice was lifted from Sunday's game due to an ankle injury and his status for Week 6 against the Vikings is undecided.,Ankle,questionable,GNB,S
Martellus Bennett,"Bennett has a foot injury, leaving his status up in the air for Week 6 against the Vikings.",Foot,questionable,GNB,TE
David Bakhtiari,Bakhtiari missed his fourth-consecutive game due to an injured hamstring and it is unclear if he will return Week 6 against the Vikings.,Hamstring,questionable,GNB,T
Joe Thomas,Thomas was absent from the lineup in the last game with an ankle injury and it is unknown if he will suit up against the Vikings during Week 6.,Ankle,questionable,GNB,LB
Ty Montgomery,Montgomery was held out of the previous game due to multiple broken ribs and it is undetermined if he will participate in Week 6 against the Vikings.,Ribs,questionable,GNB,RB
Don Barclay,Barclay has been designated for the Injured Reserve/Designated for Return list due to a foot injury and it is unknown if he will be activated November 6 against the Lions.,Foot,I-R,GNB,T
Jason Spriggs,"Spriggs suffered an injury to his hamstring and has landed on injured reserve. If designated for return, the earliest he could be activated is Week 11 against the Ravens.",Hamstring,I-R,GNB,T
Kyle Murphy,Murphy was placed on injured reserve with a foot injury and it is uncertain if he will be activated against the Steelers on November 26.,Foot,I-R,GNB,T
Brett Goode,Goode has landed on injured reserve with a hamstring injury and it is uncertain if he will be activated November 26 against the Steelers.,Hamstring,I-R,GNB,LS
Demetri Goodson,Goodson is on the PUP list while he recuperates from ACL surgery and his status for Week 7 against the Saints is up in the air.,Knee,I-R,GNB,CB
Herb Waters,Waters is on injured reserve with a shoulder injury.,Shoulder,I-R,GNB,CB
Matthew Godin,Godin has been placed on the injured reserve list with a torn ACL in his knee.,Knee,I-R,HOU,DE
Kevin Johnson,Johnson sustained a Grade 2 MCL sprain in his left knee and will likely need four-to-six weeks to heal.,Knee,out,HOU,CB
Brian Cushing,Cushing is dealing with a concussion and has been suspended 10 games by the NFL for violating the league's PED policy. He is not eligible to return until December 3 against the Titans.,Suspension,out,HOU,LB
C.J. Fiedorowicz,Fiedorowicz has landed on the injured reserve list with a concussion and will be eligible to be activated November 12 against the Rams.,Concussion,I-R,HOU,TE
Derek Newton,Newton has been placed on the Injured-Reserve/PUP list while recovering from tears to both of his patellar tendons and will not play in the 2017 season.,Knee,I-R,HOU,T
Ben Heeney,Heeney missed the last game due to a knee injury and it is unclear if he will be available against the Browns during Week 6.,Knee,questionable,HOU,LB
J.J. Watt,Watt had surgery to repair a tibial plateau fracture in his left leg and is expected to be sidelined for the remainder of the season.,Leg,out,HOU,DE
Whitney Mercilus,Mercilus suffered a torn pectoral muscle and it is expected to cost him the remainder of the season.,Pectoral,out,HOU,LB
Greg Mancz,Mancz missed his second-straight game due to a knee injury and it is unknown if he will participate in Week 6 against the Browns.,Knee,questionable,HOU,C
Kyle Fuller,Fuller will not suit up against the Chiefs on Sunday due to a hamstring issue.,Hamstring,out,HOU,C
Tyler Ervin,Ervin suffered a torn patellar tendon in his knee and is on the injured reserve list.,Knee,I-R,HOU,RB
Duane Brown,Brown has been placed on the reserve/did not report list because he is holding out for a new contract. It is unclear at what point his contract situation will be resolved.,Holdout,out,HOU,T
Deante Gray,Gray is on injured reserve due to a torn ACL.,Knee,I-R,HOU,WR
Michael Bennett,Bennett has been placed on injured reserve due to a pectoral injury.,Pectoral,I-R,JAX,DT
Allen Robinson,Robinson suffered a non-contact torn ACL in his left knee and is on the injured reserve list.,Knee,I-R,JAX,WR
Mychal Rivera,Rivera has landed on injured reserve due to a wrist injury.,Wrist,I-R,JAX,TE
Rashad Greene,Greene Sr. is on the injured reserve list with an unknown ailment.,Undisclosed,I-R,JAX,WR
Jarrod Wilson,Wilson missed the last game with a shoulder injury and it is unknown if he will play Week 6 against the Rams.,Shoulder,questionable,JAX,S
Jaelen Strong,Strong has sat out the past two games with a hamstring injury and it is uncertain if he will be available for Week 6 against the Rams.,Hamstring,questionable,JAX,WR
Lerentee McCray,McCray has been held out of the previous three games with a knee injury and it is undetermined if he will return against the Rams during Week 6.,Knee,questionable,JAX,LB
T.J. Yeldon,Yeldon has missed four-straight games with an injured hamstring and it is unclear if he will suit up against the Rams in Week 6.,Hamstring,questionable,JAX,RB
Brandon Linder,Linder missed the last game due to an illness and it is unclear if it will keep him out of the lineup against the Rams in Week 6.,Illness,questionable,JAX,OL
