Ahmad Brooks,Brooks has a back injury but is expected to line up against the Ravens on Sunday.,Back,probable,GNB,LB
Ty Montgomery,Montgomery left the previous game with a rib injury and will not play in Sunday's matchup with the Ravens.,Ribs,out,GNB,RB
Lucas Patrick,Patrick is bothered by a back injury and it is unknown if it will prevent him from being available against the Ravens on Sunday.,Back,questionable,GNB,G
Kevin King,King is dealing with a shoulder injury and it is unknown if he will take part in Sunday's game against the Ravens.,Shoulder,questionable,GNB,CB
Brett Hundley,Hundley is expected to play against the Ravens on Sunday despite picking up a hamstring injury in the last game.,Hamstring,probable,GNB,QB
Justin McCray,McCray is nursing an ankle injury and it is uncertain if he will compete against the Ravens on Sunday.,Ankle,questionable,GNB,G
Quinton Dial,Dial has missed the last two games with a chest injury but is expected to play during Sunday's contest against the Ravens.,Chest,probable,GNB,DT
Nick Perry,Perry is battling a foot injury and it is undetermined if he will line up against the Ravens on Sunday.,Foot,questionable,GNB,LB
Demetri Goodson,Goodson is on the PUP list while he recuperates from ACL surgery and it is unknown if he will be activated Sunday against the Ravens.,Knee,I-R,GNB,CB
Aaron Jones,Jones suffered a left MCL sprain and is expected to miss three-to-six weeks.,Knee,out,GNB,RB
Taybor Pepper,Pepper broke his foot and is on the injured reserve list.,Foot,I-R,GNB,LS
Kentrell Brice,Brice is dealing with an ankle injury and has been placed on the injured reserve list.,Ankle,I-R,GNB,S
Herb Waters,Waters is on injured reserve with a shoulder injury.,Shoulder,I-R,GNB,CB
Matthew Godin,Godin has been placed on the injured reserve list with a torn ACL in his knee.,Knee,I-R,HOU,DE
Brian Cushing,Cushing is dealing with a concussion and has been suspended 10 games by the NFL for violating the league's PED policy. He is not eligible to return until December 3 against the Titans.,Suspension,out,HOU,LB
Derek Newton,Newton has been placed on the Injured-Reserve/PUP list while recovering from tears to both of his patellar tendons and will not play in the 2017 season.,Knee,I-R,HOU,T
Christian Covington,Covington suffered a torn bicep and is on injured reserve.,Bicep,I-R,HOU,DE
J.J. Watt,Watt has been designated for the injured reserve list due to surgery to repair a tibial plateau fracture in his left leg.,Leg,I-R,HOU,DE
Whitney Mercilus,Mercilus suffered a torn pectoral muscle and is on the injured reserve list.,Pectoral,I-R,HOU,LB
Tyler Ervin,Ervin suffered a torn patellar tendon in his knee and is on the injured reserve list.,Knee,I-R,HOU,RB
Dylan Cole,Cole has missed the previous three games with a hamstring injury and will not return to the lineup against the Cardinals on Sunday.,Hamstring,out,HOU,LB
Julie'n Davenport,Davenport has a shoulder injury and will be inactive for Sunday's game against the Cardinals.,Shoulder,out,HOU,T
Greg Mancz,Mancz is dealing with a knee injury and his status is unclear for Sunday's matchup with the Cardinals.,Knee,questionable,HOU,C
Chris Thompson,Thompson is bothered by a knee injury and it is undetermined if it will deter him from playing against the Cardinals on Sunday.,Knee,questionable,HOU,WR
Chris Clark,Clark is nursing a shoulder injury but is likely to be a participant against the Cardinals on Sunday.,Shoulder,probable,HOU,T
Jeff Allen,Allen is dealing with a hand injury but is expected to take part in Sunday's contest against the Cardinals.,Hand,probable,HOU,G
Johnathan Joseph,Joseph is bothered by a knee injury but is likely to be available for Sunday's matchup against the Cardinals.,Knee,probable,HOU,CB
Jadeveon Clowney,Clowney was confined to a limited role in practice due to a knee injury but is expected to compete against the Cardinals on Sunday.,Knee,probable,HOU,DE
Alfred Blue,Blue has a hamstring injury and it is uncertain if it will obstruct his availability for Sunday's game against the Cardinals.,Hamstring,questionable,HOU,RB
Kareem Jackson,Jackson is hampered by a shoulder injury but is likely to be available against the Cardinals on Sunday.,Shoulder,probable,HOU,CB
Joel Heath,Heath has been held out of the last three games due to a knee injury and it is unclear if he will return against the Cardinals on Sunday.,Knee,questionable,HOU,DE
Kyle Fuller,Fuller has sat out the previous five games with a hamstring injury and it is uncertain if he will be available Sunday against the Cardinals.,Hamstring,questionable,HOU,C
Will Fuller,Fuller V exited the last game due to cracked ribs and will not suit up Sunday against the Cardinals.,Ribs,out,HOU,WR
Deshaun Watson,Watson suffered a torn right ACL and has been designated for the injured reserve list.,Knee,I-R,HOU,QB
Deante Gray,Gray is on injured reserve due to a torn ACL.,Knee,I-R,HOU,WR
Michael Bennett,Bennett has been placed on injured reserve due to a pectoral injury.,Pectoral,I-R,JAX,DT
Allen Robinson,Robinson suffered a non-contact torn ACL in his left knee and is on the injured reserve list.,Knee,I-R,JAX,WR
Rashad Greene,Greene Sr. is on the injured reserve list with an unknown ailment.,Undisclosed,I-R,JAX,WR
Mychal Rivera,Rivera has landed on injured reserve due to a wrist injury.,Wrist,I-R,JAX,TE
Calvin Pryor,Pryor III has been activated from the IR/Designated for Return list after recuperating from an ankle injury and will likely be available Sunday against the Browns.,Ankle,probable,JAX,DB
Arrelious Benn,Benn has been placed on injured reserve with a knee injury.,Knee,I-R,JAX,WR
Jermey Parnell,Parnell was held out of the last game due to a knee injury and will not play against the Browns on Sunday.,Knee,out,JAX,OL
Dede Westbrook,Westbrook has recovered from a core muscle injury and has been activated from the IR/Designated for Return list. He is likely to be in the lineup for Sunday's contest against the Browns.,Abdominal,probable,JAX,WR
Marcedes Lewis,Lewis was confined to a limited role in practice due to a knee injury but is expected to participate in Sunday's game against the Browns.,Knee,probable,JAX,DE
Lerentee McCray,McCray is battling an ankle injury but is expected to compete Sunday against the Browns.,Ankle,probable,JAX,LB
Marqise Lee,Lee has a knee injury but is expected to play Sunday against the Browns.,Knee,probable,JAX,WR
Blair Brown,Brown has a hamstring injury and it is unclear if he will participate in Sunday's game against the Browns.,Hamstring,questionable,JAX,LB
Dawuane Smoot,Smoot is nursing a knee injury and it is uncertain if he will line up against the Browns on Sunday.,Knee,questionable,JAX,DE
Patrick Omameh,Omameh is dealing with an injured quadriceps and it is unknown if he will take part in Sunday's contest against the Browns.,Quadricep,questionable,JAX,OL
Leonard Fournette,Fournette is dealing with a lingering ankle injury and it is unknown if he will take part in Sunday's contest against the Browns.,Ankle,questionable,JAX,RB
Matt Overton,Overton has landed on the injured reserve list with a shoulder injury.,Shoulder,I-R,JAX,LS
Allen Hurns,Hurns was removed from the previous game due to an ankle injury and will be inactive against the Browns on Sunday.,Ankle,out,JAX,WR
Eric Berry,Berry is on the injured reserve list with a ruptured left Achilles tendon.,Achilles,I-R,KAN,DB
Ashton Lampkin,Lampkin has been designated for the injured reserve list due to a torn ACL.,Knee,I-R,KAN,DB
Spencer Ware,Ware had season-ending surgery for a torn PCL and LCL in his right knee. He is on the injured reserve list as a result.,Knee,I-R,KAN,RB
Chris Conley,Conley ruptured his Achilles tendon and is on the injured reserve list.,Achilles,I-R,KAN,WR
Parker Ehinger,Ehinger is sidelined due to a knee injury and there is no timetable for return.,Knee,out,KAN,OL
Cairo Santos,Santos has landed on injured reserve with a groin issue and it is unknown if he will be activate against the Bills on November 26.,Groin,I-R,KAN,K
Dee Ford,Ford sat out the previous game with a back injury and will not be active against the Giants on Sunday.,Back,out,KAN,WR
Allen Bailey,Bailey exited the last game due to a sprained MCL and will not play Sunday against the Giants.,Knee,out,KAN,DL
Albert Wilson,Wilson missed the last game with a strained hamstring and will not suit up against the Giants on Sunday.,Hamstring,out,KAN,WR
Tamba Hali,Hali has a knee injury and will not take part in Sunday's game against the Giants.,Knee,out,KAN,LB
Dadi Nicolas,Nicolas is on the PUP list with a knee injury and it is unknown if he will be activated against the Giants on Sunday.,Knee,I-R,KAN,LB
Tony Lippett,Lippett has been designated for injured reserve due to a torn Achilles.,Achilles,I-R,MIA,CB
Raekwon McMillan,McMillan tore his ACL and is on the injured reserve list.,Knee,I-R,MIA,LB
Nate Allen,Allen suffered a calf injury and it is on injured reserve. He is eligible to be activated against the Bills in Week 17.,Calf,I-R,MIA,S
Anthony Steen,Steen had surgery to repair a foot injury and it is unknown if he will be activated in time for Week 17 against the Bills.,Foot,I-R,MIA,C
Eric Smith,Smith has been designated for injured reserve with a knee injury and it is unknown if he will be activated December 3 against the Broncos.,Knee,I-R,MIA,T
Bobby McCain,McCain is bothered by a thigh injury but will likely suit up against the Buccaneers on Sunday.,Thigh,probable,MIA,CB
Michael Thomas,Thomas is hampered by a knee injury and it is undetermined if it will obstruct his availability against the Buccaneers on Sunday.,Knee,questionable,MIA,S
Jarvis Landry,Landry is expected to play Sunday against the Buccaneers due to a chest injury.,Chest,probable,MIA,WR
William Hayes,Hayes has injuries to his knee and right hand but is expected to play Sunday against the Buccaneers.,Knee,probable,MIA,DE
Kenny Stills,Stills will likely be available for Sunday's contest against the Buccaneers despite suffering a back injury.,Back,probable,MIA,WR
Ndamukong Suh,Suh has a knee injury but is expected to suit up against the Buccaneers on Sunday.,Knee,probable,MIA,DT
Senorise Perry,Perry has a knee injury and it is unclear if he will participate against the Buccaneers on Sunday.,Knee,questionable,MIA,RB
Rashawn Scott,Scott has been activated from the PUP list as he has recovered from a foot injury. It is undetermined if he will suit up against the Buccaneers on Sunday.,Foot,questionable,MIA,WR
Ja'Wuan James,James sustained a hamstring injury and has landed on injured reserve.,Hamstring,I-R,MIA,T
Koa Misi,Misi has landed on injured reserve with a neck injury.,Neck,I-R,MIA,LB
Isaiah Ford,Ford has been placed on the injured reserve with a knee injury.,Knee,I-R,MIA,WR
Ryan Tannehill,Tannehill suffered a partially torn ACL in his right knee and is on the injured reserve list.,Knee,I-R,MIA,QB
Lamin Barrow,Barrow has been placed on the injured reserve list with a foot injury.,Foot,I-R,MIA,LB
Dalvin Cook,Cook has been designated for the injured reserve list due to a torn left ACL.,Knee,I-R,MIN,RB
Jeremiah Sirles,Sirles has a knee injury and has missed the past two games but is expected to return against the Rams on Sunday.,Knee,probable,MIN,G
Mike Remmers,Remmers is in the league's concussion protocol and will not be cleared in time for Sunday contest against the Rams.,Concussion,out,MIN,T
Andrew Sendejo,Sendejo is dealing with injuries to his groin and hamstring. He will be inactive against the Rams on Sunday.,Groin,out,MIN,S
Brian Robison,Robison hurt his back and his status is unclear for Sunday's game against the Rams.,Back,questionable,MIN,DE
Anthony Harris,Harris has a hamstring injury and it is unclear if he will partake in Sunday's game against the Rams.,Hamstring,questionable,MIN,S
Everson Griffen,Griffen missed the last game with a foot injury but is likely to play Sunday against the Rams.,Foot,probable,MIN,DE
Danny Isidora,Isidora sat out the previous game due to ankle injury and it is unknown if he will be available against the Rams on Sunday.,Ankle,questionable,MIN,G
Sharrif Floyd,Floyd has landed on the Injured Reserve/Non-Football Injury list as he is recuperating from meniscus surgery. Team officials are concerned that it could be career-threatening as he is experiencing complications in his recovery.,Knee,I-R,MIN,DT
Sam Bradford,Bradford had his left knee scoped and has been placed on the injured reserve list.,Knee,I-R,MIN,QB
Bishop Sankey,Sankey has been placed on the injured reserve list with a knee injury.,Knee,I-R,MIN,RB
Jon Dorenbos,Dorenbos underwent heart surgery to repair an aortic aneuysm and is on the Injured Reserve/Non-Football Injury list.,Heart,I-R,NOR,LS
Alex Anzalone,Anzalone suffered a right shoulder injury and is on the injured reserve list.,Shoulder,I-R,NOR,LB
Nathan Stupar,Stupar has been placed on the injured reserve list due to a torn ACL.,Knee,I-R,NOR,LB
John Kuhn,Kuhn has landed on injured reserve with a torn biceps.,Bicep,I-R,NOR,FB
David Parry,Parry is on injured reserve due to an ankle injury and it is unclear if he will return November 26 against the Rams.,Ankle,I-R,NOR,DT
Zach Strief,Strief has been placed on the injured reserve list with a right knee injury and it is uncertain if he will be activated December 3 against the Panthers.,Knee,I-R,NOR,T
A.J. Klein,Klein has an ankle injury and it is unclear if he will take part in Sunday's game against the Redskins.,Ankle,questionable,NOR,LB
De'Vante Harris,Harris is dealing with a hamstring injury and it is unknown if he will compete against the Redskins on Sunday.,Hamstring,questionable,NOR,CB
Daniel Lasco,Lasco suffered a bulging disc and is on the injured reserve list.,Spine,I-R,NOR,RB
Kenny Vaccaro,Vaccaro suffered a groin injury and missed the last game. His status Sunday against the Redskins is undetermined.,Groin,questionable,NOR,S
Mitchell Loewen,Loewen sustained an ankle injury and is on the injured reserve list. It is uncertain if he will be activated Sunday against the Redskins.,Ankle,I-R,NOR,DL
Delvin Breaux,Breaux is on the injured reserve list with a fractured fibula in his left leg.,Leg,I-R,NOR,CB
Nick Fairley,Fairley has been placed on the Injured Reserve/Non-Football Illness list due to a heart condition.,Heart,I-R,NOR,DT
Dan Arnold,Arnold is on the injured reserve list with an unspecified ailment.,Undisclosed,I-R,NOR,WR
Clay Harbor,Harbor is on injured reserve with an unspecified injury.,Undisclosed,I-R,NOR,TE
Keionta Davis,Davis has been designated for injured reserve as he is recovering from a bulging disc in his neck.,Neck,I-R,NWE,DL
Julian Edelman,Eldeman tore the ACL in his right knee and is on the injured reserve list.,Knee,I-R,NWE,WR
Cyrus Jones,Jones suffered a torn ACL in his right knee and is on injured reserve as a result.,Knee,I-R,NWE,CB
Harvey Langi,Langi has been placed on the IR/Non-Football Injury list due to a back injury.,Back,I-R,NWE,LB
Marcus Cannon,Cannon sat out the last game with an ankle injury and will not be available against the Raiders on Sunday.,Ankle,out,NWE,OL
Chris Hogan,Hogan is recovering from a right shoulder injury and will not be ready to return to the lineup Sunday against the Raiders.,Shoulder,out,NWE,WR
Matt Slater,Slater departed the last game due to an injured hamstring and will not play in Sunday's matchup against the Raiders.,Hamstring,out,NWE,WR
Martellus Bennett,Bennett is dealing with injuries to his shoulder and hamstring and is uncertain to play Sunday against the Raiders.,Shoulder,questionable,NWE,TE
Alan Branch,Branch has a neck injury and it is unclear if he will take part in Sunday's matchup against the Raiders.,Neck,questionable,NWE,DL
Danny Amendola,Amendola has a lingering knee injury but is expected to suit up Sunday against the Raiders.,Knee,probable,NWE,WR
Antonio Garcia,Garcia has landed on the Injured Reserve/Non-Football Illness list with an unspecified illness. It is unclear if he will be activated prior to Sunday's contest against the Raiders.,Illness,I-R,NWE,OL
Malcom Brown,Brown has been held out of the past two games with an ankle injury. It is unclear if he will play against the Raiders on Sunday.,Ankle,questionable,NWE,DL
Andrew Jelks,Jelks has landed on the Injured Reserve/Non-Football Injury list due to a knee injury and it is uncertain if he will be activated in time for Sunday's game against the Raiders.,Knee,I-R,NWE,OL
Vincent Valentine,Valentine has landed on the injured reserve list with a knee injury. He will be eligible to be activated against the Raiders on Sunday.,Knee,I-R,NWE,DT
Eric Rowe,Rowe has been held out of the previous four games with an injured groin and it is uncertain if he will return Sunday against the Raiders.,Groin,questionable,NWE,DB
Malcolm Mitchell,Mitchell is hampered by a knee injury and is on the injured reserve list. It is undetermined if he will be activated in time for Sunday's game against the Raiders.,Knee,I-R,NWE,WR
Cassius Marsh,Marsh missed the last game with a shoulder injury and it is unclear if he will take part in Sunday's game against the Raiders.,Shoulder,questionable,NWE,DE
Shea McClellin,McClellin has been placed on the IR/Designated for Return list with a concussion and is expected to miss the remainder of the season.,Concussion,I-R,NWE,LB
Dont'a Hightower,Hightower suffered a torn pectoral muscle and is on the injured reserve list.,Pectoral,I-R,NWE,LB
Derek Rivers,Rivers is on injured reserve after suffering a torn ACL in his left knee.,Knee,I-R,NWE,DE
Josh Banks,Banks has been placed on the injured reserve list with a shoulder injury.,Shoulder,I-R,NYG,DT
Mark Herzlich,Herzlich is battling a stinger and is on injured reserve.,Stinger,I-R,NYG,LB
Romeo Okwara,Okwara has landed on the injured reserve list with a sprained MCL in his knee.,Knee,I-R,NYG,DE
Brandon Marshall,Marshall has been placed on injured reserve due to left ankle surgery.,Ankle,I-R,NYG,WR
Dwayne Harris,Harris is on injured reserve due to a fracture of his fifth metatarsal in his foot.,Foot,I-R,NYG,WR
Odell Beckham,Beckham Jr. has been designated for the injured reserve list due to season-ending surgery to repair a fractured left ankle.,Ankle,I-R,NYG,WR
J.T. Thomas,Thomas has landed on injured reserve with a groin issue. He can be activated as early as Week 12 against the Redskins.,Groin,I-R,NYG,LB
Sterling Shepard,Shepard has come down with an illness and his status is unclear for Sunday's matchup with the Chiefs.,Illness,questionable,NYG,WR
Kelvin Sheppard,Sheppard left the last game due to a groin injury and is not expected to play Sunday against the Chiefs.,Groin,doubtful,NYG,LB
B.J. Goodson,Goodson missed his second-straight game with an ankle injury and will not suit up against the Chiefs on Sunday.,Ankle,out,NYG,LB
D.J. Fluker,Fluker has a knee injury and it is unclear if he will participate in Sunday's game against the Chiefs.,Knee,questionable,NYG,G
Calvin Munson,Munson is dealing with an injured quadriceps and it is unknown if he will take part in Sunday's contest against the Chiefs.,Quadricep,questionable,NYG,LB
Dalvin Tomlinson,Tomlinson is battling an ankle injury and his availability against the Chiefs on Sunday is murky.,Ankle,questionable,NYG,DT
Jason Pierre-Paul,Pierre-Paul is nursing a knee injury and it is uncertain if it will keep him out of the lineup against the Chiefs on Sunday.,Knee,questionable,NYG,DE
Keenan Robinson,Robinson suffered an injured quadriceps and is on the injured reserve list.,Quadricep,I-R,NYG,LB
Devon Kennard,Kennard missed the last game with an injured quadriceps and it is uncertain if he will participate in Sunday's tilt against the Chiefs.,Quadricep,questionable,NYG,LB
Donte Deayon,Deayon was held out of the last game with an ankle injury and it is uncertain if he will suit up Sunday against the Chiefs.,Ankle,questionable,NYG,CB
Damon Harrison,Harrison exited the previous game with an ankle injury and it is unknown if he will play against the Chiefs on Sunday.,Ankle,questionable,NYG,DT
Justin Pugh,Pugh has a back injury and there is no timetable for return.,Back,out,NYG,G
Nigel Harris,Harris has been designated for injured reserve with a ribs injury.,Ribs,I-R,NYG,LB
Weston Richburg,Richburg has landed on injured reserve as he works his way through the NFL's concussion protocol. It is unknown if he will be activated when first eligible against the Redskins on New Year's Eve.,Concussion,I-R,NYG,C
Evan Schwan,Schwan has been designated for the injured reserve list with a broken foot.,Foot,I-R,NYG,DE
Antwon Blake,Blake is away from the team tending to a personal matter and will miss an undetermined amount of time.,Personal,out,NYG,CB
Keeon Johnson,Johnson has been placed on the injured reserve with a broken foot.,Foot,I-R,NYG,WR
Kevin Norwood,Norwood has been designated for injured reserve due to a hip injury.,Hip,I-R,NYG,WR
Ishaq Williams,Williams has been placed on injured reserve while he recovers from offseason knee surgery.,Knee,I-R,NYG,DE
Edmond Robinson,Robinson is on injured reserve due to a groin injury.,Groin,I-R,NYJ,CB
Chris Gragg,Gragg has been placed on the injured reserve with a knee injury.,Knee,I-R,NYJ,TE
Jordan Leggett,Leggett has been placed on the injured reserve list with a knee injury and will be eligible to return against the Patriots on December 31.,Knee,I-R,NYJ,TE
Xavier Coleman,Coleman has been placed on injured reserve with a torn labrum in his shoulder.,Shoulder,I-R,NYJ,CB
Charone Peake,Peake has landed on the injured reserve with an ankle injury and will be eligible to be activated against the Panthers in Week 12.,Ankle,I-R,NYJ,WR
Dylan Donahue,Donahue is on the injured reserve list with an elbow injury and it is uncertain if he will return December 3 against the Chiefs.,Elbow,I-R,NYJ,LB
Christian Hackenberg,Hackenberg was held out of the last game due to a right finger injury and it is uncertain if he will play against the Panthers during Week 12.,Finger,questionable,NYJ,QB
Matt Forte,Forte sat out the previous game with swelling in his surgically-repaired knee and it is unknown if he will take the field against the Panthers in Week 12.,Knee,questionable,NYJ,RB
Morris Claiborne,Claiborne aggravated a previous foot injury in the last game and his status for Week 12 against the Panthers is undecided.,Foot,questionable,NYJ,CB
Lorenzo Mauldin,Mauldin has a back injury and is on injured reserve. It is undetermined if he will return Week 12 against the Panthers.,Back,I-R,NYJ,LB
Jonotthan Harrison,Harrison missed the last game with a hand injury and it is unclear if he will play Week 12 against the Panthers.,Hand,questionable,NYJ,OL
Jeremy Kerley,Kerley has been given a four-game suspension by the NFL for violating the league's stance on performance enhancing drugs but is expected to be available Week 15 against the Saints.,Suspension,out,NYJ,WR
Brisly Estime,Estime has landed on injured reserve due to a torn Achilles tendon.,Achilles,I-R,NYJ,WR
Devin Smith,Smith has been placed on the injured reserve list while he recovers from a torn ACL.,Knee,I-R,NYJ,WR
Jeremy Clark,Clark has been placed on the Injured Reserve/Non-Football Injury list with a knee injury.,Knee,I-R,NYJ,CB
Quincy Enunwa,Enunwa has been placed on the injured reserve list after having surgery to repair a bulging disc in his neck.,Neck,I-R,NYJ,WR
Doug Middleton,Middleton sustained a torn pectoral muscle and is on the injured reserve list.,Pectoral,I-R,NYJ,S
Bryson Keeton,Keeton has been placed on the injured reserve list with a torn ACL.,Knee,I-R,NYJ,CB
Harry Douglas,Douglas has been designated for injured reserve due to a knee injury.,Knee,I-R,TEN,WR
Alex Tanney,Tanney has landed in the injured reserve list with a broken foot.,Foot,I-R,TEN,QB
Tajae Sharpe,Sharpe is on injured reserve due to a foot injury.,Foot,I-R,TEN,WR
Brian Orakpo,Orakpo left the last game due to a leg injury and his status for Week 12 against the Colts is undecided.,Leg,questionable,TEN,LB
Kevin Byard,Byard sustained a shoulder injury in the last game but is expected to play against the Colts in Week 12.,Shoulder,probable,TEN,S
Aaron Wallace,Wallace has landed on injured reserve with a back injury and it is unclear if he will be activated Week 12 against the Colts.,Back,I-R,TEN,LB
Victor Ochi,Ochi has landed on the injured reserve list with a knee injury.,Knee,I-R,TEN,LB
Darren Sproles,Sproles has been designated for the injured reserve list due to a torn ACL and a broken arm.,Knee,I-R,PHI,RB
Donnel Pumphrey,Pumphrey is on the injured reserve list with a torn hamstring.,Hamstring,I-R,PHI,RB
Jordan Hicks,Hicks tore his right Achilles and is on injured reserve.,Achilles,I-R,PHI,LB
Jason Peters,Peters tore the ACL and MCL in his right knee and is on the injured reserve list.,Knee,I-R,PHI,T
Chris Maragos,Maragos has landed on injured reserve with a knee injury and will not be eligible to return until Week 15 against the Giants.,Knee,I-R,PHI,S
Ronald Darby,Darby has been out of action due to a dislocated right ankle but will likely return to face the Cowboys on Sunday.,Ankle,probable,PHI,CB
Jaylen Watkins,Watkins has a hamstring injury but is likely to participate in Sunday's game against the Cowboys.,Hamstring,probable,PHI,S
Alshon Jeffery,Jeffery is expected to take the field for Sunday's game against the Cowboys despite an ankle injury.,Ankle,probable,PHI,WR
Caleb Sturgis,"Sturgis has landed on the injured reserve list with a strained quadriceps in his plant leg and is unlikely to return when first eligible, Sunday against the Cowboys.",Quadricep,I-R,PHI,K
Sidney Jones,Jones is on the Injured Reserve/Non-Football Injury list while he recovers from a torn Achilles' tendon. It is unknown if he will be activated Sunday against the Cowboys.,Achilles,I-R,PHI,CB
