Ramon Foster,Foster exited the last game with a left hand injury and it is unclear if he will play Sunday against the Ravens.,Hand,questionable,PIT,G
Sean Davis,"Davis departed the previous game with an ankle injury, leaving his availability against the Ravens on Sunday up in the air.",Ankle,questionable,PIT,S
T.J. Watt,Watt was absent from the lineup during the previous game due to a groin injury but is expected to take the field Sunday against the Ravens.,Groin,probable,PIT,LB
Cameron Sutton,Sutton has landed on the injured reserve with right hamstring injury and his availability for Week 10 against the Colts is uncertain.,Hamstring,I-R,PIT,CB
Keion Adams,Adams has a shoulder injury and is on the injured reserve list.,Shoulder,I-R,PIT,LB
Amari Cooper,Cooper is nursing a lingering knee injury but is expected to play against the Broncos on Sunday.,Knee,probable,OAK,WR
Jalen Richard,Richard has a strained calf muscle but is likely to play against the Broncos on Sunday.,Calf,probable,OAK,RB
Michael Crabtree,Crabtree has an injury to his chest but is expected to play against the Broncos on Sunday.,Chest,probable,OAK,WR
Gareon Conley,Conley is dealing with a lingering injured shin and it is undetermined if he will participate in Sunday's game against the Broncos.,Shin,questionable,OAK,CB
Sebastian Janikowski,Janikowski has been placed on the injured reserve list with a back injury and is first eligible to return November 5 against the Dolphins.,Back,I-R,OAK,K
Obi Melifonwu,Melifonwu has been placed on injured reserve after undergoing surgery to repair a knee injury but is expected to return Week 9 against the Dolphins.,Knee,I-R,OAK,S
Denver Kirkland,Kirkland has landed on injured reserve due to a leg injury and it is undetermined if he will be activated against the Bills during Week 8.,Leg,I-R,OAK,G
Aldon Smith,Smith remains suspended for an undetermined amount of time for violating the league's substance-abuse program.,Suspension,out,OAK,LB
Tavon Austin,Austin was removed from the previous game as he is going through the concussion protocol and his status Sunday against the Cowboys is unknown.,Concussion,questionable,LAR,WR
Sammy Watkins,Watkins left the previos game to be evaluated for a concussion and it is undetermined if he will play Sunday against the Cowboys.,Concussion,questionable,LAR,WR
John Sullivan,Sullivan exited the last game with a groin injury and his availability for Sunday's contest against the Cowboys is clouded.,Groin,questionable,LAR,C
Lamarcus Joyner,Joyner departed the last game with a left hamstring injury and it is uncertain if he will suit up against the Cowboys on Sunday.,Hamstring,questionable,LAR,S
Malcolm Brown,Brown was held out of the last game due to a hamstring injury and it is uncertain if he will play Sunday against the Cowboys.,Hamstring,questionable,LAR,RB
Kayvon Webster,Webster sat out his second-straight game due to a shoulder injury and it is undetermined if he will be active against the Cowboys on Sunday.,Shoulder,questionable,LAR,CB
Temarrick Hemingway,Hemingway sustained a fractured fibula and is on injured reserve.,Shin,I-R,LAR,TE
Mike Thomas,Thomas has been suspended four games for violating the league's policy on performance-enhancing drugs. He will be eligible to return against the Seahawks in Week 5.,Suspension,out,LAR,WR
Lance Dunbar,Dunbar has been placed on the PUP list with a knee injury and will miss the first six weeks of the 2017 season.,Knee,I-R,LAR,RB
Bradley Marquez,Marquez is on injured reserve with a knee injury.,Knee,I-R,LAR,WR
Dominique Easley,Easley has landed on the injured reserve list due to a torn ACL.,Knee,I-R,LAR,DT
Ben Watson,"Watson hurt his calf, leaving his availability against the Steelers on Sunday in question.",Calf,questionable,BAL,TE
Brent Urban,Urban suffered a lisfranc foot sprain and is on the injured reserve list.,Foot,I-R,BAL,DE
Jeremy Maclin,Maclin is dealing with a head injury and his availability is in question for Sunday's game against the Steelers.,Head,questionable,BAL,WR
Dieugot Joseph,Joseph missed Sunday's game due to a personal matter. His status Sunday against the Steelers is unclear.,Personal,questionable,BAL,OL
Maxx Williams,Williams missed his last game with an ankle injury and it is uncertain if he will available Sunday against the Steelers.,Ankle,questionable,BAL,TE
Jaylen Hill,Hill has missed the previous three games with a hamstring injury and it is undetermined if he will play Sunday against the Steelers.,Hamstring,questionable,BAL,CB
Brandon Williams,Williams missed his last game due to a foot injury. His status Sunday against the Steelers is uncertain.,Foot,questionable,BAL,DT
Marshal Yanda,Yanda has been placed on injured reserve with a fractured ankle.,Ankle,I-R,BAL,G
Bam Bradley,Bradley has been placed on the injured reserve list with a torn ACL in his knee.,Knee,I-R,BAL,LB
Sheldon Price,Price has been placed on the injured reserve list with a concussion and is eligible to return November 19 against the Packers.,Concussion,I-R,BAL,CB
Kenneth Dixon,Dixon had season-ending surgery to repair his medial meniscus and has been issued a six-game suspension for violating the league's policy on performance-enhancing drugs.,Knee,I-R,BAL,RB
Danny Woodhead,Woodhead has landed on the injured reserve list after he aggravated a hamstring injury. The earliest he can be activated if designated for return is November 19 against the Packers.,Hamstring,I-R,BAL,RB
Maurice Canady,Canady suffered a knee injury and is on injured reserve. It is unclear if he will be activated against the Titans during Week 9.,Knee,I-R,BAL,CB
Brandon Boykin,Boykin has landed on injured reserve due to an undefined injury.,Undisclosed,I-R,BAL,CB
Tim White,White has been placed on the injured reserve with a thumb injury.,Thumb,I-R,BAL,WR
Nico Siragusa,Siragusa has been placed on the injured reserve with a torn ACL in his left knee.,Knee,I-R,BAL,G
Albert McClellan,McClellan has been placed on the injured reserve with a torn ACL.,Knee,I-R,BAL,LB
Alex Lewis,Lewis had surgery to repair a shoulder injury and is on the injured reserve list.,Shoulder,I-R,BAL,G
Tavon Young,Young is on the injured reserve list with a torn ACL and will miss the entire 2017 season.,Knee,I-R,BAL,CB
Darren Waller,Waller has been suspended for at least one year for violating the league's substance-abuse policy.,Suspension,out,BAL,TE
Crockett Gillmore,Gillmore has been placed on the injured reserve list with after having MCL surgery.,Knee,I-R,BAL,TE
Mike Williams,Williams is recovering from an offseason back injury and is not expected to make his season Sunday against the Eagles.,Back,doubtful,LAC,WR
Jeremiah Attaochu,Attaochu is sidelined with a pulled hamstring and his availability against the Eagles on Sunday is in question.,Hamstring,questionable,LAC,DE
Hayes Pullard,Pullard III missed the last game with a knee injury and it is unclear if he will suit up for Sunday's game against the Eagles.,Knee,questionable,LAC,LB
Melvin Gordon,Gordon has been diagnosed with a knee contusion and his status is undetermined for Sunday's game against the Eagles.,Knee,questionable,LAC,RB
Joe Barksdale,Barksdale sat out the last game with a foot injury and it is unknown if he will play against the Eagles on Sunday.,Foot,questionable,LAC,T
Jason Verrett,Verrett has been placed on the injured reserve list with a knee injury.,Knee,I-R,LAC,CB
Chris Hairston,Hairston has landed on the Injured Reserve/Non-Football Illness list with blood clots.,Illness,I-R,LAC,T
Max Tuerk,Turek has been issued a four-game suspension for violating the league's PED policy but is likely to make his season debut during Week 5 against the Giants.,Suspension,out,LAC,C
Denzel Perryman,Perryman had surgery to fix a torn ligament in his ankle and is on the injured reserve list. It is unknown if he will play Week 10 against the Jaguars.,Ankle,I-R,LAC,LB
Forrest Lamp,Lamp sustained a torn ACL in his right knee and is on the injured reserve list.,Knee,I-R,LAC,G
Chris Landrum,Landrum is on the injured reserve list with a shoulder injury.,Shoulder,I-R,LAC,DE
Charmeachealle Moore,Moore has been designated for injured reserve with an unspecified injury.,Undisclosed,I-R,LAC,LB
Asante Cleveland,Cleveland has been placed on injured reserve due to a right knee injury.,Knee,I-R,LAC,TE
Doug Baldwin,Baldwin left the previous game due to a groin strain but is expected to suit up Sunday against the Colts.,Groin,probable,SEA,WR
Richard Sherman,Sherman has an Achilles injury and it is unclear if he will suit up against the Colts on Sunday.,Achilles,questionable,SEA,CB
C.J. Prosise,Prosise has an ankle injury and will not take part in Sunday's matchup against the Colts.,Ankle,out,SEA,RB
Dewey McDonald,McDonald tore his ACL in his knee and is on the injured reserve list.,Knee,I-R,SEA,LB
Jimmy Graham,Graham is dealing with an ankle injury and his status is in question for Sunday's game against the Colts.,Ankle,questionable,SEA,TE
Earl Thomas,Thomas is likely to play Sunday against the Colts despite a knee injury.,Knee,probable,SEA,S
Neiko Thorpe,Thorpe departed the last game with an sprained ankle and it is uncertain if he will take part in Sunday's contest against the Colts.,Ankle,questionable,SEA,CB
D.J. Alexander,Alexander missed the last game with a hamstring injury and it is unknown if he will play against the Colts on Sunday.,Hamstring,questionable,SEA,LB
Dion Jordan,Jordan had an operation to repair a knee injury and is on the Injured Reserve/Non-Football Injury list. It is unclear if he will return October 29 against the Texans.,Knee,I-R,SEA,DE
George Fant,Fant suffered a torn ACL in his right knee and is on the injured reserve list.,Knee,I-R,SEA,T
DeAndre Elliott,Elliott has a right ankle injury and is on the injured reserve list.,Ankle,I-R,SEA,CB
DeShawn Shead,Shead underwent surgery to repair the torn ACL in his left knee and is on the Pup list. It is undetermined if he will return during Week 8 against the Texans.,Knee,I-R,SEA,CB
Malik McDowell,McDowell has landed on the Injured Reserve/Non-Football Injury list with a concussion and facial fractures. His status for October 29 against the Texans is clouded.,Concussion,I-R,SEA,DT
Reuben Foster,Foster will not return to action against the Cardinals on Sunday as he is sidelined with a right high-ankle sprain.,Ankle,out,SFO,LB
Kyle Juszczyk,Juszczyk left the last game due to a concussion but is expected to be cleared in time for Sunday's game against the Cardinals.,Concussion,probable,SFO,FB
Carlos Hyde,Hyde is expected to take the field against the Cardinals on Sunday despite being confined to a limited role in practice with a hip issue.,Hip,probable,SFO,RB
Jaquiski Tartt,Tartt departed the previous game due to a concussion and it is unknown if he will pass through the league's protocol in time for Sunday's contest against the Cardinals.,Concussion,questionable,SFO,S
Brock Coyle,Coyle was forced from the last game due to a concussion and it is uncertain if he will suit up against the Cardinals on Sunday.,Concussion,questionable,SFO,LB
Tank Carradine,Carradine is on the injured reserve list due to a right high-ankle sprain and it is unknown if he will be activated December 3 against the Bears.,Ankle,I-R,SFO,DL
Eric Reid,Reid suffered an injury to the PCL in his left knee and will likely need two-to-three weeks to recover.,Knee,out,SFO,S
Ronald Blair,Blair III has been designated for injured reserve with a thumb injury.,Thumb,I-R,SFO,DL
Chris Jones,Jones is dealing with an unspecified injury and is on injured reserve.,Undisclosed,I-R,SFO,DL
Joshua Garnett,Garnett had a procedure performed on his knee and is on the injured reserve list.,Knee,I-R,SFO,G
Aaron Burbridge,Burbridge has landed on injured reserve with a hamstring injury.,Hamstring,I-R,SFO,WR
Don Jones,Jones has been designated for injured reserve with a torn ACL in his left knee.,Knee,I-R,SFO,DB
Donavin Newsom,Newsom has been diagnosed with a concussion and is on the injured reserve list.,Concussion,I-R,SFO,LB
Chanceller James,James is on injured reserve with a knee injury.,Knee,I-R,SFO,S
Malcolm Smith,Smith sustained a torn pectoral muscle and is on the injured reserve list.,Pectoral,I-R,SFO,LB
Jimmie Gilbert,Gilbert has been placed on injured reserve due to a torn ACL.,Knee,I-R,SFO,LB
Brent Grimes,Grimes sat out the previous game due to a shoulder injury but is likely to take part in Sunday's contest against the Giants.,Shoulder,probable,TAM,CB
Robert Ayers,Ayers was confined to a limited role in practice due to a knee injury and it is unknown if he will partake in Sunday's game against the Giants.,Knee,questionable,TAM,DE
J.R. Sweezy,Sweezy is nursing a back injury and it is uncertain if he will be active Sunday against the Giants.,Back,questionable,TAM,G
Jacquies Smith,Smith has recovered from ACL surgery and is dealing with an illness. It is likely that he will be in Sunday's lineup against the Giants.,Illness,probable,TAM,DE
Chris Baker,Baker missed the last game due to an illness but is expected to be a participant in Sunday's matchup against the Giants.,Illness,probable,TAM,DT
T.J. Ward,Ward has a hip injury and it is unclear if he will play Sunday against the Giants.,Hip,questionable,TAM,S
Noah Spence,Spence will likely suit up against the Giants on Sunday despite a dislocated shoulder.,Shoulder,probable,TAM,DE
Gerald McCoy,McCoy left the last game with an ankle injury and his status Sunday against the Giants is unclear.,Ankle,questionable,TAM,DT
Kwon Alexander,Alexander was held out of the previous game with a hamstring injury and it is undetermined if he will suit up against the Giants on Sunday.,Hamstring,questionable,TAM,LB
Lavonte David,David suffered a left medial-ankle sprain and is expected to be out of action for at least one month.,Knee,out,TAM,LB
Ryan Griffin,Griffin has been placed on the injured reserve list due to a sprained AC joint in his shoulder and it is unclear if he will play Week 9 against the Saints.,Shoulder,I-R,TAM,QB
Stevie Tu'ikolovatu,Tu'ikolovatu has been placed on the injured reserve with an injured MCL and meniscus in his right knee.,Knee,I-R,TAM,DT
DaVonte Lambert,Lambert has been placed on the injured reserve with a dislocated wrist.,Wrist,I-R,TAM,DL
Justin Trattou,Trattou has landed on the injured reserve list with an unspecified ailment.,Undisclosed,I-R,TAM,DE
Jordan Reed,Reed was held out of the last game due to a chest contusion and an AC joint sprain in his shoulder. It is undetermined if he will be in the lineup Monday against the Chiefs.,Shoulder,questionable,WAS,TE
Ty Nsekhe,Nsekhe has a core muscle injury and will not participate in Monday's game against the Chiefs.,Abdominal,out,WAS,T
Samaje Perine,Perine left the last game due to a hand contusion and it is unknown if he will play Monday against the Chiefs.,Hand,questionable,WAS,RB
Robert Kelley,Kelley sat out the last game with injured ribs and it is unclear if he will play against the Chiefs on Monday.,Ribs,questionable,WAS,RB
Mason Foster,Foster missed the previous game due to a separated right shoulder and it is uncertain if he will suit up against the Chiefs on Monday.,Shoulder,questionable,WAS,LB
Su'a Cravens,Cravens had offseason surgery to trim the meniscus in his knee and is on the Injured Reserve/Left Squad list.,Knee,I-R,WAS,S
Phil Taylor,Taylor Sr. has a quadriceps injury and is on the injured reserve list.,Quadricep,I-R,WAS,DL
DeAngelo Hall,Hall is on the PUP list while recuperating from surgery to repair a torn ACL in his knee and it is unclear if he will be activated October 29 against the Cowboys.,Knee,I-R,WAS,S
Kevin Bowen,Bowen is on injured reserve with a left ankle injury.,Ankle,I-R,WAS,T
Trent Murphy,Murphy suffered an ACL and MLC tear and will spend the entire 2017 season on the injured reserve list.,Knee,I-R,WAS,LB
Keith Marshall,Marshall has been placed on injured reserve after having surgery to repair a torn right patellar tendon.,Knee,I-R,WAS,RB
