Demetri Goodson,Goodson is on the PUP list while he recuperates from ACL surgery and his status for Week 7 against the Saints is up in the air.,Knee,I-R,GNB,CB
Herb Waters,Waters is on injured reserve with a shoulder injury.,Shoulder,I-R,GNB,CB
D.J. Reader,Reader is nursing a knee injury and it is uncertain if he will be active against the Titans on Sunday.,Knee,questionable,HOU,NT
Greg Mancz,Mancz is battling a knee injury and it is unknown if he will be a participant in Sunday's game against the Titans.,Knee,questionable,HOU,C
DeAndre Hopkins,Hopkins is expected to suit up against the Titans on Sunday despite a lingering knee injury.,Knee,probable,HOU,WR
Will Fuller,Fuller broke his collarbone in training camp but is lining up to make his season debut against the Titans on Sunday.,Collarbone,probable,HOU,WR
Jeff Allen,Allen has been absent from the lineup during the previous two games due to an ankle injury but is likely to suit up against the Titans on Sunday.,Ankle,probable,HOU,G
Xavier Su'a-Filo,"Su'a-Filo is hampered by a knee injury, leaving his status for Sunday's tilt against the Titans clouded.",Knee,questionable,HOU,G
Marcus Burley,Burley has a knee injury and it is unclear if it will keep him out of the lineup against the Titans on Sunday.,Knee,questionable,HOU,DB
Alfred Blue,Blue has been held out of the past three games due to an ankle injury but is likely to take the field against the Titans on Sunday.,Ankle,probable,HOU,RB
Andre Hal,Hal exited the last game due to a head injury and it is unknown if he will play Sunday against the Titans.,Head,questionable,HOU,S
Matthew Godin,Godin has been placed on the injured reserve list with a torn ACL in his knee.,Knee,I-R,HOU,DE
Kevin Johnson,Johnson sustained a Grade 2 MCL sprain in his left knee and will likely need four-to-six weeks to heal.,Knee,out,HOU,CB
Brian Cushing,Cushing is dealing with a concussion and has been suspended 10 games by the NFL for violating the league's PED policy. He is not eligible to return until December 3 against the Titans.,Suspension,out,HOU,LB
C.J. Fiedorowicz,Fiedorowicz has landed on the injured reserve list with a concussion and will be eligible to be activated November 12 against the Rams.,Concussion,I-R,HOU,TE
Derek Newton,Newton has been placed on the Injured-Reserve/PUP list while recovering from tears to both of his patellar tendons and will not play in the 2017 season.,Knee,I-R,HOU,T
Duane Brown,Brown has been placed on the reserve/did not report list because he is holding out for a new contract. It is unclear at what point his contract situation will be resolved.,Holdout,out,HOU,T
Deante Gray,Gray is on injured reserve due to a torn ACL.,Knee,I-R,HOU,WR
Malik Jackson,Jackson is dealing with a groin injury and it is unclear if he will be available against the Jets on Sunday.,Groin,questionable,JAX,DL
Jalen Ramsey,"Ramsey has a lingering ankle injury, leaving his status in question for Sunday's game against the Jets.",Ankle,questionable,JAX,CB
Donald Payne,Payne is battling a hamstring injury and it is unclear if he will suit up against the Jets on Sunday.,Hamstring,questionable,JAX,LB
Brandon Linder,"Linder is hampered by a knee injury, leaving his availability clouded for Sunday's game against the Jets.",Knee,questionable,JAX,OL
Myles Jack,Jack was confined to a limited role in practice due to an ankle injury and it is uncertain if he will participate in Sunday's game against the Jets.,Ankle,questionable,JAX,LB
T.J. Yeldon,Yeldon has missed the last three games due to a hamstring injury and his availability against the Jets on Sunday is in question.,Hamstring,questionable,JAX,RB
Jaelen Strong,Strong is nursing a hamstring injury and his status against the Jets on Sunday is unclear.,Hamstring,questionable,JAX,WR
Lerentee McCray,McCray missed the previous game with a knee injury and his status for Sunday's matchup against the Jets is unclear.,Knee,questionable,JAX,LB
Michael Bennett,Bennett has been placed on injured reserve due to a pectoral injury.,Pectoral,I-R,JAX,DT
Calvin Pryor,Pryor III is on the injured reserve list with an ankle injury and it is uncertain if he will be activated November 26 against the Cardinals.,Ankle,I-R,JAX,DB
Allen Robinson,Robinson suffered a non-contact torn ACL in his left knee and is on the injured reserve list.,Knee,I-R,JAX,WR
Dede Westbrook,Westbrook has a core muscle injury and has been placed on injured reserve. The earliest he can be activate if designated for return is November 12 against the Chargers.,Abdominal,I-R,JAX,WR
Mychal Rivera,Rivera has landed on injured reserve due to a wrist injury.,Wrist,I-R,JAX,TE
Rashad Greene,Greene Sr. is on the injured reserve list with an unknown ailment.,Undisclosed,I-R,JAX,WR
De'Anthony Thomas,Thomas departed the last game due to a shoulder injury and it is unknown if he will play against the Redskins on Monday.,Shoulder,questionable,KAN,WR
Cameron Erving,Erving has been held out of the previous three games with an injury to his calf and his availability against the Redskins on Monday has yet to be determined.,Calf,questionable,KAN,OL
Cairo Santos,Santos has landed on injured reserve with a groin issue and it is unknown if he will be activate against the Jets on December 3.,Groin,I-R,KAN,K
Dee Ford,Ford exited the previous game with an injured hip and it is unclear if he will play Monday against the Redskins.,Hip,questionable,KAN,WR
Parker Ehinger,Ehinger has sat out the previous three games due to a knee injury and it is uncertain if he will be available against the Redskins on Monday.,Knee,questionable,KAN,OL
Mitch Morse,Morse has a foot sprain and there is no timetable for return.,Foot,out,KAN,OL
Eric Berry,Berry is on the injured reserve list with a ruptured left Achilles tendon.,Achilles,I-R,KAN,DB
Steven Nelson,Nelson has been placed on the injured reserve/designated to return list due to core muscle surgery and it is unknown if he will be activated against the Broncos during Week 9.,Abdominal,I-R,KAN,DB
Dadi Nicolas,Nicolas has landed on the PUP list with a knee injury and it is unknown if he will be activated against the Raiders on October 19.,Knee,I-R,KAN,LB
Spencer Ware,Ware had season-ending surgery for a torn PCL and LCL in his right knee. He is on the injured reserve list as a result.,Knee,I-R,KAN,RB
Ashton Lampkin,Lampkin has been designated for the injured reserve list due to a torn ACL.,Knee,I-R,KAN,DB
Tamba Hali,Hali has been placed on the PUP list with a knee injury and it is uncertain if he will return October 19 against the Raiders.,Knee,I-R,KAN,LB
Jakeem Grant,Grant is hampered by an ankle injury and it is unknown if he will partake in Sunday's matchup against the Saints.,Ankle,questionable,MIA,WR
John Denney,Denney is nursing a hamstring injury and it is undetermined if he will play Sunday against the Saints.,Hamstring,questionable,MIA,LS
Kenny Stills,Stills was confined to a limited role in practice due to a hand injury and it is unclear if he will suit up Sunday against the Saints.,Hand,questionable,MIA,WR
Nate Allen,Allen is battling a hamstring injury but is expected to participate in Sunday's game against the Saints.,Hamstring,probable,MIA,S
Jay Ajayi,Ajayi is likely to suit up against the Saints on Sunday despite a knee injury.,Knee,probable,MIA,RB
Kiko Alonso,Alonso is battling a shoulder injury and his availability against the Saints on Sunday is murky.,Shoulder,questionable,MIA,LB
Eric Smith,Smith is incapacitated with a knee injury and it is unclear if he will be active Sunday against the Saints.,Knee,questionable,MIA,T
Chase Allen,"Allen is bothered by neck injury, leaving his availability unclear for Sunday's game against the Saints.",Neck,questionable,MIA,LB
Stephone Anthony,Anthony has been held out of the past three games with a high-ankle sprain and it is unknown if he will make his season debut in London against the Saints in on Sunday.,Ankle,questionable,MIA,LB
Rey Maualuga,Maualuga has been held out of the previous two games due to a hamstring strain and it is undetermined if he will take part in Sunday's contest against the Saints.,Hamstring,questionable,MIA,LB
Jordan Phillips,Phillips missed the previous game due to an ankle injury and it is uncertain if he will partake in Sunday's matchup against the Saints.,Ankle,questionable,MIA,DT
Byron Maxwell,Maxwell departed the last game with an eye injury and his status Sunday against the Saints is in question.,Eye,questionable,MIA,CB
Ted Larsen,Larsen tore his biceps and is on injured reserve.,Bicep,I-R,MIA,C
Tony Lippett,Lippett has been designated for injured reserve due to a torn Achilles.,Achilles,I-R,MIA,CB
Rashawn Scott,Scott has been designated for the PUP list due to a foot injury and it is uncertain if he will be activated October 22 against the Jets.,Foot,I-R,MIA,WR
Raekwon McMillan,McMillan tore his ACL and is on the injured reserve list.,Knee,I-R,MIA,LB
T.J. McDonald,McDonald has been handed an eight-game suspension for violating the league's substance abuse policy but is expected to make his season debut November 5th against the Raiders.,Suspension,out,MIA,S
Koa Misi,Misi has landed on injured reserve with a neck injury.,Neck,I-R,MIA,LB
Isaiah Ford,Ford has been placed on the injured reserve with a knee injury.,Knee,I-R,MIA,WR
Ryan Tannehill,Tannehill suffered a partially torn ACL in his right knee and is on the injured reserve list.,Knee,I-R,MIA,QB
Lamin Barrow,Barrow has been placed on the injured reserve list with a foot injury.,Foot,I-R,MIA,LB
Stephen Weatherly,Weatherly is ailing from an illness and it is unknown if he will suit up against the Lions on Sunday.,Illness,questionable,MIN,DE
Danny Isidora,Isidora sat out his third-straight game due to a knee injury and his status is uncertain for Sunday's matchup against the Lions.,Knee,questionable,MIN,G
Sam Bradford,Bradford has been held out of the previous two games due to a bone bruise in his right knee and it is unclear if he will return for Sunday's matchup against the Lions.,Knee,questionable,MIN,QB
Teddy Bridgewater,Bridgewater is on the PUP list while recovering from a dislocated knee and torn ACL but is likely to return Week 7 against the Ravens.,Knee,I-R,MIN,QB
Sharrif Floyd,Floyd has landed on the Injured Reserve/Non-Football Injury list as he is recuperating from meniscus surgery that took place last season and team officials are concerned that it could be career-threatening as he is experiencing complications in his recove,Knee,I-R,MIN,DT
Michael Floyd,Floyd has been suspended four games for violating the league's policy on performance-enhancing drugs. He will be eligible to join the team against the Bears in Week 5.,Suspension,out,MIN,WR
Bishop Sankey,Sankey has been placed on the injured reserve list with a knee injury.,Knee,I-R,MIN,RB
Marshon Lattimore,Lattimore missed the last game due to a concussion but is likely to be cleared in time for Sunday's tilt against the Dolphins.,Concussion,probable,NOR,CB
Nathan Stupar,Stupar is nursing a hamstring injury and it is undetermined if he will participate in Sunday's game against the Dolphins.,Hamstring,questionable,NOR,LB
David Parry,Parry is on injured reserve due to an ankle injury and it is unclear if he will return December 3 against the Panthers.,Ankle,I-R,NOR,DT
Zach Strief,Strief suffered a sprained MCL in his left knee and it is unknown if he will return for Sunday's game against the Dolphins.,Knee,questionable,NOR,T
Terron Armstead,Armstead has been absent from the lineup during the last three games while recovering from surgery to repair a torn labrum and it is unknown if he will be active against the Dolphins on Sunday.,Shoulder,questionable,NOR,T
Sterling Moore,Moore suffered a pectoral injury and is expected to need at least a few weeks to recover.,Pectoral,out,NOR,CB
Mitchell Loewen,Loewen sustained an ankle injury and is on the injured reserve list. It is uncertain if he will be activated November 26 against the Rams.,Ankle,I-R,NOR,DL
Jon Dorenbos,Dorenbos underwent heart surgery to repair an aortic aneuysm and is on the Injured Reserve/Non-Football Injury list.,Heart,I-R,NOR,LS
Delvin Breaux,Breaux is on the injured reserve list with a fractured fibula in his left leg and it is uncertain if he will return Week 9 against the Buccaneers.,Leg,I-R,NOR,CB
Corey Fuller,Fuller has been placed on the injured reserve with an undisclosed injury.,Undisclosed,I-R,NOR,WR
Nick Fairley,Fairley has been placed on the Injured Reserve/Non-Football Illness list due to a heart condition.,Heart,I-R,NOR,DT
Dan Arnold,Arnold is on the injured reserve list with an unspecified ailment.,Undisclosed,I-R,NOR,WR
Clay Harbor,Harbor is on injured reserve with an unspecified injury.,Undisclosed,I-R,NOR,TE
Martin Wallace,Wallace has been designated for injured reserve with an unspecified injury.,Undisclosed,I-R,NOR,T
Stephon Gilmore,Gilmore is tending to a groin injury and it is uncertain if he will take part in Sunday's tilt against the Panthers.,Groin,questionable,NWE,CB
Phillip Dorsett,Dorsett is bothered by a knee injury but is likely available against the Panthers on Sunday.,Knee,probable,NWE,QB
Danny Amendola,Amendola is expected to take part in Sunday's contest against the Panthers despite a knee injury.,Knee,probable,NWE,WR
Rob Gronkowski,Gronkowski is expected to participate in Sunday's game against the Panthers despite a groin injury.,Groin,probable,NWE,TE
Nate Ebner,"Ebner has a shoulder injury, leaving his availability unknown against the Panthers on Sunday.",Shoulder,questionable,NWE,DB
Dont'a Hightower,Hightower sat out his second-consecutive game due to an MCL sprain in his right knee and it is undetermined if he will return to the active lineup against the Panthers on Sunday.,Knee,questionable,NWE,LB
Marcus Cannon,Cannon sat out the previous game with an ankle injury and a concussion. His availability against the Panthers on Sunday is clouded.,Ankle,questionable,NWE,OL
Eric Rowe,Rowe missed his second-straight game due to a groin injury and it is unclear if he will play Sunday against the Panthers.,Groin,questionable,NWE,DB
Jacob Hollister,Hollister left the last game with a shoulder injury and his status against the Panthers on Sunday is up in the air.,Shoulder,questionable,NWE,TE
Matt Slater,Slater has been held out of the past three games due to a hamstring injury and it is undecided if he will make his season debut during Sunday against the Panthers.,Hamstring,questionable,NWE,WR
Rex Burkhead,Burkhead was held out of the last game due to injured ribs and it is unknown if he will take the field against the Panthers on Sunday.,Ribs,questionable,NWE,RB
Vincent Valentine,Valentine has landed on the injured reserve list with a knee injury. He will be eligible to be activated against the Dolphins during Week 12.,Knee,I-R,NWE,DT
Malcolm Mitchell,Mitchell is hampered by a knee injury and is on the injured reserve list. It is undetermined if he will be activated Week 10 against the Broncos.,Knee,I-R,NWE,WR
Shea McClellin,McClellin has been placed on the injured reserve list with an unspecified injury.,Undisclosed,I-R,NWE,LB
Andrew Jelks,Jelks has landed on the Injured Reserve/Non-Football Injury list due to a knee injury and it is uncertain if he will be activated October 22 against the Falcons.,Knee,I-R,NWE,OL
Julian Edelman,Eldeman tore the ACL in his right knee and is on the injured reserve list.,Knee,I-R,NWE,WR
Cyrus Jones,Jones suffered a torn ACL in his right knee and is on injured reserve as a result.,Knee,I-R,NWE,CB
Antonio Garcia,Garcia has landed on the Injured Reserve/Non-Football Illness list with an unspecified illness.,Illness,I-R,NWE,OL
Keionta Davis,Davis has been designated for injured reserve as he is recovering from a bulging disc in his neck.,Neck,I-R,NWE,DL
Derek Rivers,Rivers is on injured reserve after suffering a torn ACL in his left knee.,Knee,I-R,NWE,DE
Shane Vereen,"Vereen has a calf injury, leaving his status for Sunday's game against the Buccaneers up in the air.",Calf,questionable,NYG,RB
Jonathan Casillas,Casillas is dealing with injuries to his ankle and wrist. It is unclear if he will suit up against the Buccaneers on Sunday.,Ankle,questionable,NYG,LB
J.T. Thomas,Thomas missed the last game due to an injured groin and it is uncertain if he will be available Sunday against the Buccaneers.,Groin,questionable,NYG,LB
B.J. Goodson,Goodson missed the previous two games with an injury to his shin and his status is unclear for Sunday's contest against the Buccaneers.,Shin,questionable,NYG,LB
Orleans Darkwa,Darkwa is nursing a back injury and but it is not expected to prevent him from suiting up against the Buccaneers on Sunday.,Back,probable,NYG,RB
Bobby Hart,Hart missed the previous game with an ankle injury his status is unknown for Sunday's tilt against the Buccaneers.,Ankle,questionable,NYG,G
Olivier Vernon,Vernon left Sunday's game with an ankle injury and did not return. His status Sunday against the Buccaneers is uncertain.,Ankle,questionable,NYG,DE
Mark Herzlich,Herzlich is battling a stinger and is on injured reserve.,Stinger,I-R,NYG,LB
Josh Banks,Banks has been placed on the injured reserve list with a shoulder injury.,Shoulder,I-R,NYG,DT
Evan Schwan,Schwan has been designated for the injured reserve list with a broken foot.,Foot,I-R,NYG,DE
Adam Gettis,Gettis has been placed on the injured reserve list with a foot injury.,Foot,I-R,NYG,T
Antwon Blake,Blake is away from the team tending to a personal matter and will miss an undetermined amount of time.,Personal,out,NYG,CB
Keeon Johnson,Johnson has been placed on the injured reserve with a broken foot.,Foot,I-R,NYG,WR
Kevin Norwood,Norwood has been designated for injured reserve due to a hip injury.,Hip,I-R,NYG,WR
Corbin Bryant,Bryant has landed on injured reserve with a dislocated elbow.,Elbow,I-R,NYG,DT
Ishaq Williams,Williams has been placed on injured reserve while he recovers from offseason knee surgery.,Knee,I-R,NYG,DE
Charone Peake,Peake has landed on the injured reserve with an ankle injury and will be eligible to be activated against the Chiefs in Week 13.,Ankle,I-R,NYJ,WR
Matt Forte,Forte departed the last game due to turf toe and will not suit up Sunday against the Jaguars.,Toe,out,NYJ,RB
Muhammad Wilkerson,Wilkerson suffered a Grade 1 AC joint sprain in his shoulder but it is not expected to prevent him from suiting up Sunday against the Jaguars.,Shoulder,probable,NYJ,DL
Rontez Miles,Miles has missed the previous three games with an eye injury but is likely to be available against the Jaguars on Sunday.,Eye,probable,NYJ,S
Leonard Williams,Williams was confined to a limited role in practice due to an injured wrist and it is undetermined if he will be active against the Jaguars on Sunday.,Wrist,questionable,NYJ,DL
Brandon Shell,Shell is tending to a shoulder injury and it is unclear if he will be a participant in Sunday's game against the Jaguars.,Shoulder,questionable,NYJ,T
Josh Martin,Martin left the previous game due to an ankle injury and his it is unclear if he will play against the Jaguars on Sunday.,Ankle,questionable,NYJ,LB
Jordan Leggett,Leggett missed his third-straight game with a knee injury and it is undetermined if he will be available against the Jaguars on Sunday.,Knee,questionable,NYJ,TE
Brian Winters,Winters sat out the previous game due to soreness in his abdomen and it is unknown if he will play against the Jaguars on Sunday.,Abdominal,questionable,NYJ,G
Eric Tomlinson,Tomlinson has been absent from the lineup during the past two games with an elbow injury and it is uncertain if he will return against the Jaguars on Sunday.,Elbow,questionable,NYJ,TE
Edmond Robinson,Robinson is on injured reserve due to a groin injury.,Groin,I-R,NYJ,CB
Lorenzo Mauldin,Mauldin has a back injury and is on injured reserve. It is undetermined if he will return Week 9 against the Bills.,Back,I-R,NYJ,LB
Jalin Marshall,Marshall is serving a four-game suspension for violating the league's policy on PED's but is likely to be available October 8 against the Browns.,Suspension,out,NYJ,WR
Chris Gragg,Gragg has been placed on the injured reserve with a knee injury.,Knee,I-R,NYJ,TE
Brisly Estime,Estime has landed on injured reserve due to a torn Achilles tendon.,Achilles,I-R,NYJ,WR
Devin Smith,Smith has been placed on the injured reserve list while he recovers from a torn ACL.,Knee,I-R,NYJ,WR
Jeremy Clark,Clark has been placed on the Injured Reserve/Non-Football Injury list with a knee injury.,Knee,I-R,NYJ,CB
Anthony Johnson,Johnson has been designated for the injured reserve list due to a stinger.,Stinger,I-R,NYJ,DL
Quincy Enunwa,Enunwa has been placed on the injured reserve list after having surgery to repair a bulging disc in his neck.,Neck,I-R,NYJ,WR
Doug Middleton,Middleton sustained a torn pectoral muscle and is on the injured reserve list.,Pectoral,I-R,NYJ,S
Bryson Keeton,Keeton has been placed on the injured reserve list with a torn ACL.,Knee,I-R,NYJ,CB
Delanie Walker,Walker has a hamstring injury and his status for Sunday's contest against the Texans is in question.,Hamstring,questionable,TEN,TE
DeMarco Murray,Murray is expected to be a participant in Sunday's game against the Texans despite a hamstring injury.,Hamstring,probable,TEN,RB
Erik Walden,Walden is dealing with a groin injury and it is uncertain if he will play Sunday against the Texans.,Groin,questionable,TEN,LB
Corey Davis,Davis will not play Sunday against the Texans after already missing the last game due to a strained hamstring.,Hamstring,out,TEN,WR
Taywan Taylor,Taylor sat out the previous game due to a lower-body injury and it is uncertain if he will suit up Sunday against the Texans.,Lower Body,questionable,TEN,WR
Jonathan Cyprien,Cyprien sustained an injured hamstring and it is undetermined if he will return to the lineup during against the Texans on Sunday.,Hamstring,questionable,TEN,S
Derrick Henry,Henry has a thigh contusion but is expected to suit up against the Texans on Sunday.,Thigh,probable,TEN,RB
Aaron Wallace,Wallace has landed on injured reserve with a back injury and it is unclear if he will be activated November 26 against the Colts.,Back,I-R,TEN,LB
Harry Douglas,Douglas has been designated for injured reserve due to a knee injury.,Knee,I-R,TEN,WR
Tajae Sharpe,Sharpe is on injured reserve due to a foot injury.,Foot,I-R,TEN,WR
Alex Tanney,Tanney has landed in the injured reserve list with a broken foot.,Foot,I-R,TEN,QB
Victor Ochi,Ochi has landed on the injured reserve list with a knee injury.,Knee,I-R,TEN,LB
Jason Kelce,Kelce is battling a knee injury and it is unclear if he will be available Sunday against the Chargers.,Knee,questionable,PHI,C
Jordan Hicks,Hicks has an ankle injury but it is not expected to impede his availability for Sunday's game against the Chargers.,Ankle,probable,PHI,LB
Rodney McLeod,McLeod sat out the previous game with a Grade 1 hamstring strain but is likely to be available for Sunday's matchup against the Chargers.,Hamstring,probable,PHI,S
Destiny Vaeao,Vaeao missed the last two games due to an injured wrist and it is undetermined if he will be available against the Chargers on Sunday.,Wrist,questionable,PHI,DT
Fletcher Cox,"Cox departed the previous game due to a calf injury, leaving his status against the Chargers on Sunday unclear.",Calf,questionable,PHI,DT
Jaylen Watkins,Watkins sat out his previous game with a hamstring injury and it is undetermined if he will play against the Chargers on Sunday.,Hamstring,questionable,PHI,S
Corey Graham,Graham missed the previous game with a hamstring injury and his status is unclear against the Chargers on Sunday.,Hamstring,questionable,PHI,S
Darren Sproles,Sproles has been designated for the injured reserve list due to a torn ACL and a broken arm.,Knee,I-R,PHI,RB
Donnel Pumphrey,Pumphrey is on the injured reserve list with a torn hamstring.,Hamstring,I-R,PHI,RB
Caleb Sturgis,Sturgis has landed on the injured reserve list wit ha strained quadriceps in his plant leg and will not be eligible to return until November 19 against the Cowboys.,Quadricep,I-R,PHI,K
Ronald Darby,Darby suffered a dislocated right ankle and is expected to miss four-to-six weeks.,Ankle,out,PHI,CB
Sidney Jones,Jones is on the Injured Reserve/Non-Football Injury list while he recovers from a torn Achilles' tendon and it is unknown if he will be activated for October 23rd's game against the Redskins.,Achilles,I-R,PHI,CB
Dom Williams,Williams has been designated for injured reserve with an Achilles injury.,Achilles,I-R,PHI,WR
Aziz Shittu,Shittu has been placed on the injured reserve list due to a knee injury.,Knee,I-R,PHI,DT
Randall Goforth,Goforth has landed on injured reserve with a torn ACL.,Knee,I-R,PHI,CB
Martavis Bryant,Bryant is ailing from an illness but it is not expected to impede his status for Sunday's game against the Ravens.,Illness,probable,PIT,WR
Mike Mitchell,Mitchell has a hamstring injury and it is unclear if he will be active Sunday against the Ravens.,Hamstring,questionable,PIT,S
Jesse James,James is likely to take part in Sunday's contest against the Ravens despite a shoulder injury.,Shoulder,probable,PIT,TE
Marcus Gilbert,Gilbert sat out the previous game due to a hamstring injury but is likely to be available against the Ravens on Sunday.,Hamstring,probable,PIT,T
Bud Dupree,Dupree is nursing a shoulder injury and it is unknown if he will participate in Sunday's matchup against the Ravens.,Shoulder,questionable,PIT,LB
Stephon Tuitt,Tuitt has been held out of the past two games due to a biceps injury and his availability is uncertain against the Ravens on Sunday.,Bicep,questionable,PIT,DE
Jerald Hawkins,Hawkins has been inactive during the past three games due to a knee injury and it is undetermined if he will return for Sunday's matchup against the Ravens.,Knee,questionable,PIT,T
