Reggie Ragland,Ragland was absent from the lineup during the previous game as he is recovering from a knee injury and it is uncertain if he will make his NFL debut against the Eagles during Week 2.,Knee,questionable,KAN,LB
Parker Ehinger,Ehinger sat out the last game due to a knee injury and it is unclear if he will play Week 2 against the Eagles.,Knee,questionable,KAN,OL
Steven Nelson,Nelson has been placed on the injured reserve/designated to return list due to core muscle surgery and it is unknown if he will be activated against the Broncos during Week 9.,Abdominal,I-R,KAN,DB
Spencer Ware,Ware had season-ending surgery for a torn PCL and LCL in his right knee. He is on the injured reserve list as a result.,Knee,I-R,KAN,RB
Dadi Nicolas,Nicolas has landed on the PUP list with a knee injury and it is unknown if he will be activated against the Raiders on October 19.,Knee,I-R,KAN,LB
Ashton Lampkin,Lampkin has been designated for the injured reserve list due to a torn ACL.,Knee,I-R,KAN,DB
Tamba Hali,Hali has been placed on the PUP list with a knee injury and it is uncertain if he will return October 19 against the Raiders.,Knee,I-R,KAN,LB
Rey Maualuga,Maualuga is dealing with a conditioning issue and his status is unclear for the regular season opener against the Chargers.,Conditioning,questionable,MIA,LB
Ted Larsen,Larsen tore his biceps and is on injured reserve.,Bicep,I-R,MIA,C
Rashawn Scott,Scott has been designated for the PUP list due to a foot injury and it is uncertain if he will be activated October 22 against the Jets.,Foot,I-R,MIA,WR
Raekwon McMillan,McMillan tore his ACL and is on the injured reserve list.,Knee,I-R,MIA,LB
Tony Lippett,Lippett has been designated for injured reserve due to a torn Achilles.,Achilles,I-R,MIA,CB
T.J. McDonald,McDonald has been handed an eight-game suspension for violating the league's substance abuse policy but is expected to make his season debut November 5th against the Raiders.,Suspension,out,MIA,S
Koa Misi,Misi has landed on injured reserve with a neck injury.,Neck,I-R,MIA,LB
Isaiah Ford,Ford has been placed on the injured reserve with a knee injury.,Knee,I-R,MIA,WR
Ryan Tannehill,Tannehill suffered a partially torn ACL in his right knee and is on the injured reserve list.,Knee,I-R,MIA,QB
Lamin Barrow,Barrow has been placed on the injured reserve list with a foot injury.,Foot,I-R,MIA,LB
Anthony Harris,Harris is expected to suit up against the Saints on Monday despite a leg injury.,Leg,probable,MIN,S
Brian Robison,Robison is dealing with a groin injury and it is unclear if he will play Monday against the Saints.,Groin,questionable,MIN,DE
Danny Isidora,Isidora has a knee injury and his status against the Vikings on Monday is clouded.,Knee,questionable,MIN,G
Tramaine Brock,"Brock is battling a groin injury, leaving his availability for the season opener against the Saints up in the air.",Groin,questionable,MIN,DB
Sharrif Floyd,Floyd has landed on the Injured Reserve/Non-Football Injury list as he is recuperating from meniscus surgery that took place last season and team officials are concerned that it could be career-threatening as he is experiencing complications in his recove,Knee,I-R,MIN,DT
Teddy Bridgewater,Bridgewater is on the PUP list while recovering from a dislocated knee and torn ACL and will miss the first six weeks of the 2017 season.,Knee,I-R,MIN,QB
Datone Jones,Jones is on injured reserve with a shoulder injury.,Shoulder,I-R,MIN,DE
Michael Floyd,Floyd has been suspended four games for violating the league's policy on performance-enhancing drugs. He will be eligible to join the team against the Bears in Week 5.,Suspension,out,MIN,WR
Bishop Sankey,Sankey has been placed on the injured reserve list with a knee injury.,Knee,I-R,MIN,RB
Trey Hendrickson,Hendrickson is battling an illness and his status for the season opener against the Vikings is uncertain.,Illness,questionable,NOR,DE
Jon Dorenbos,Dorenbos is ailing from an illness and it is unknown if he will partake in Monday's matchup against the Vikings.,Illness,questionable,NOR,LS
Nathan Stupar,"Stupar has an injured hamstring, leaving his availability up in the air for Monday's contest against the Vikings.",Hamstring,questionable,NOR,LB
Chase Daniel,Daniel is bothered by an ankle injury and it is unclear if he will be active for Monday's tilt against the Vikings.,Ankle,questionable,NOR,QB
Terron Armstead,Armstead has been activated from the PUP list as he recovers from surgery to repair a torn labrum but is not expected to play Monday against the Vikings.,Shoulder,doubtful,NOR,T
Delvin Breaux,Breaux is on the injured reserve list with a fractured fibula in his left leg and it is uncertain if he will return Week 9 against the Buccaneers.,Leg,I-R,NOR,CB
John Phillips,Phillips is recovering from an appendicitis and is on injured reserve.,Appendix,I-R,NOR,TE
Willie Snead,Snead IV has been issued a three-game suspension for violating the league's policy on substance of abuse but is expected to return October 1 against the Dolphins.,Suspension,out,NOR,WR
Corey Fuller,Fuller has been placed on the injured reserve with an undisclosed injury.,Undisclosed,I-R,NOR,WR
Bryan Braman,Braman has been placed on the injured reserve with an unspecified injury.,Undisclosed,I-R,NOR,LB
Nick Fairley,Fairley has been placed on the Injured Reserve/Non-Football Illness list due to a heart condition.,Heart,I-R,NOR,DT
Dan Arnold,Arnold is on the injured reserve list with an unspecified ailment.,Undisclosed,I-R,NOR,WR
Stephone Anthony,Anthony is hampered by a high-ankle sprain and is expected to miss three weeks.,Ankle,out,NOR,LB
Clay Harbor,Harbor is on injured reserve with an unspecified injury.,Undisclosed,I-R,NOR,TE
Martin Wallace,Wallace has been designated for injured reserve with an unspecified injury.,Undisclosed,I-R,NOR,T
Dont'a Hightower,Hightower was forced from previous game due to a right knee injury and his status is in question for Week 2 against the Saints.,Knee,questionable,NWE,LB
Cameron Fleming,Fleming missed the last game due to an ankle injury and it is unclear if it will prevent him from playing Week 2 against the Saints.,Ankle,questionable,NWE,OL
Nate Ebner,Ebner was absent from the lineup during the last game due to an injured shoulder and his availability for Week 2 against the Saints is in question.,Shoulder,questionable,NWE,DB
Danny Amendola,Amendola sustained a head injury and his status is week-to-week going forward.,Head,out,NWE,WR
Matt Slater,Slater was held out of the last game due to a hamstring injury and it is undecided if he will be available for Week 2 against the Saints.,Hamstring,questionable,NWE,WR
Harvey Langi,Langi sat out the previous game to a concussion and it is uncertain if he will be active against the Saints in Week 2.,Concussion,questionable,NWE,LB
Vincent Valentine,Valentine sat out the previous game with a knee injury and it is unknown if he will play against the Saints during Week 2.,Knee,questionable,NWE,DT
Malcolm Mitchell,Mitchell is hampered by a knee injury and is on the injured reserve list. It is undetermined if he will be activated Week 10 against the Broncos.,Knee,I-R,NWE,WR
Shea McClellin,McClellin has been placed on the injured reserve list with an unspecified injury.,Undisclosed,I-R,NWE,LB
Cyrus Jones,Jones suffered a torn ACL in his right knee and is on injured reserve as a result.,Knee,I-R,NWE,CB
Andrew Jelks,Jelks has landed on the Injured Reserve/Non-Football Injury list due to a knee injury and it is uncertain if he will be activated October 22 against the Falcons.,Knee,I-R,NWE,OL
Antonio Garcia,Garcia has landed on the Injured Reserve/Non-Football Illness list with an unspecified illness.,Illness,I-R,NWE,OL
Julian Edelman,Eldeman tore the ACL in his right knee and is on the injured reserve list.,Knee,I-R,NWE,WR
Keionta Davis,Davis has been designated for injured reserve as he is recovering from a bulging disc in his neck.,Neck,I-R,NWE,DL
Derek Rivers,Rivers is on injured reserve after suffering a torn ACL in his left knee.,Knee,I-R,NWE,DE
Dwayne Harris,Harris has an upper-body injury but is expected to play Sunday against the Cowboys.,Upper Body,probable,NYG,WR
Tavarres King,King is hampered by an ankle injury but is likely to participate in the season opener against the Cowboys.,Ankle,probable,NYG,WR
Eli Apple,Apple is dealing with an ankle injury but is expected to be ready for Sunday's game against the Cowboys.,Ankle,probable,NYG,CB
Jay Bromley,Bromley is nursing an ankle injury but is likely to be available against the Cowboys on Sunday.,Knee,probable,NYG,DT
Odell Beckham,Beckham Jr sprained his left ankle and his status for Sunday's game against the Cowboys is in question.,Ankle,questionable,NYG,WR
Keenan Robinson,Robinson is dealing with a concussion and his status against the Cowboys in the season opener is clouded.,Concussion,questionable,NYG,LB
Brandon Marshall,Marshall is bothered by injuries to his ankle and shoulder but is expected to suit up against the Cowboys in the season opener.,Shoulder,probable,NYG,WR
Mark Herzlich,Herzlich is battling a stinger and is on injured reserve.,Stinger,I-R,NYG,LB
Josh Banks,Banks has been placed on the injured reserve list with a shoulder injury.,Shoulder,I-R,NYG,DT
Evan Schwan,Schwan has been designated for the injured reserve list with a broken foot.,Foot,I-R,NYG,DE
Adam Gettis,Gettis has been placed on the injured reserve list with a foot injury.,Foot,I-R,NYG,T
Antwon Blake,Blake is away from the team tending to a personal matter and will miss an undetermined amount of time.,Personal,out,NYG,CB
Keeon Johnson,Johnson has been placed on the injured reserve with a broken foot.,Foot,I-R,NYG,WR
Kevin Norwood,Norwood has been designated for injured reserve due to a hip injury.,Hip,I-R,NYG,WR
Corbin Bryant,Bryant has landed on injured reserve with a dislocated elbow.,Elbow,I-R,NYG,DT
Ishaq Williams,Williams has been placed on injured reserve while he recovers from offseason knee surgery.,Knee,I-R,NYG,DE
Jordan Leggett,"Leggett has a knee injury, leaving his status in doubt for the season opener against the Bills.",Knee,doubtful,NYJ,TE
Rontez Miles,Miles is recovering from an eye injury and is not expected to play Sunday against the Bills.,Eye,out,NYJ,S
Bryce Petty,Petty has been diagnosed with a Grade 1 MCL sprain in his left knee but is likely to be available against the Bills in the season opener.,Knee,probable,NYJ,QB
Matt Forte,Forte is expected to be ready for the season opener against the Bills despite battling a Grade 1 hamstring strain.,Hamstring,probable,NYJ,RB
Leonard Williams,Williams has a left wrist injury but is likely to suit up for the season opener against the Bills.,Wrist,probable,NYJ,DL
ArDarius Stewart,Stewart is recovering from surgeries on his thumb and groin. His availability for the season opener against the Bills is in question.,Thumb,questionable,NYJ,WR
Lorenzo Mauldin,Mauldin has a back injury and is on injured reserve. It is undetermined if he will return Week 9 against the Bills.,Back,I-R,NYJ,LB
Jalin Marshall,Marshall is serving a four-game suspension for violating the league's policy on PED's but is likely to be available October 8 against the Browns.,Suspension,out,NYJ,WR
Corey Lemonier,Lemoiner has been placed on the injured reserve with a foot injury.,Foot,I-R,NYJ,LB
Chris Gragg,Gragg has been placed on the injured reserve with a knee injury.,Knee,I-R,NYJ,TE
Brisly Estime,Estime has landed on injured reserve due to a torn Achilles tendon.,Achilles,I-R,NYJ,WR
Devin Smith,Smith has been placed on the injured reserve list while he recovers from a torn ACL.,Knee,I-R,NYJ,WR
Jeremy Clark,Clark has been placed on the Injured Reserve/Non-Football Injury list with a knee injury.,Knee,I-R,NYJ,CB
Anthony Johnson,Johnson has been designated for the injured reserve list due to a stinger.,Stinger,I-R,NYJ,DL
Quincy Enunwa,Enunwa has been placed on the injured reserve list after having surgery to repair a bulging disc in his neck.,Neck,I-R,NYJ,WR
Doug Middleton,Middleton sustained a torn pectoral muscle and is on the injured reserve list.,Pectoral,I-R,NYJ,S
Bryson Keeton,Keeton has been placed on the injured reserve list with a torn ACL.,Knee,I-R,NYJ,CB
Taywan Taylor,Taylor has a calf injury but is expected to play in the season opener against the Raiders.,Calf,probable,TEN,WR
LeShaun Sims,Sims is dealing with a groin injury and his status for Sunday's game against the Raiders is in question.,Groin,questionable,TEN,CB
Eric Decker,Decker has an injury to his ankle but is likely to participate in the season opener against the Raiders.,Ankle,probable,TEN,WR
Taylor Lewan,Lewan is nursing an ankle injury and his availability against the Raiders on Sunday is undecided.,Ankle,questionable,TEN,T
Kevin Dodd,Dodd is battling a foot injury that plagued him for most of the 2016 season but is expected to suit up for the season opener against the Raiders.,Foot,probable,TEN,LB
Corey Davis,Davis is batting a hamstring injury but is expected to play in the season opener against the Raiders.,Hamstring,probable,TEN,WR
Harry Douglas,Douglas has been designated for injured reserve due to a knee injury.,Knee,I-R,TEN,WR
Alex Tanney,Tanney has landed in the injured reserve list with a broken foot.,Foot,I-R,TEN,QB
Tajae Sharpe,Sharpe is on injured reserve due to a foot injury.,Foot,I-R,TEN,WR
Victor Ochi,Ochi has landed on the injured reserve list with a knee injury.,Knee,I-R,TEN,LB
Nick Foles,Foles has an arm injury but is expected to be available for the season opener against the Redskins.,Arm,probable,PHI,QB
Jaylen Watkins,Watkins is nursing a foot injury and his availability for Sunday's game against the Redskins is up in the air.,Foot,questionable,PHI,S
Donnel Pumphrey,Pumphrey is dealing with a head injury and will not suit up against the Redskins on Sunday.,Head,out,PHI,RB
Beau Allen,Allen is nursing a pectoral injury but is expected to play in the season opener against the Redskins.,Pectoral,probable,PHI,DT
Sidney Jones,Jones is on the Injured Reserve/Non-Football Injury list while he recovers from a torn Achilles' tendon and it is unknown if he will be activated for October 23rd's game against the Redskins.,Achilles,I-R,PHI,CB
Dom Williams,Williams has been designated for injured reserve with an Achilles injury.,Achilles,I-R,PHI,WR
Aziz Shittu,Shittu has been placed on the injured reserve list due to a knee injury.,Knee,I-R,PHI,DT
Randall Goforth,Goforth has landed on injured reserve with a torn ACL.,Knee,I-R,PHI,CB
Javon Hargrave,Hargrave is dealing with a concussion but will be available against the Browns on Sunday.,Concussion,probable,PIT,DT
Bud Dupree,Dupree is battling a shoulder injury and it is undetermined if he will suit up against the Browns in the season opener.,Shoulder,questionable,PIT,LB
Jerald Hawkins,"Hawkins has a knee injury, leaving his status up in the air for Sunday's game against the Browns.",Knee,questionable,PIT,T
Jordan Dangerfield,Dangerfield is on the injured reserve list with an ankle injury and it is unknown if he will be activated against the Colts in Week 10.,Ankle,I-R,PIT,S
Le'Veon Bell,Bell had offseason surgery to repair a groin injury but is expected to return to action Sunday against the Browns.,Groin,probable,PIT,RB
Cameron Sutton,Sutton has landed on the injured reserve with right hamstring injury and his availability for Week 10 against the Colts is uncertain.,Hamstring,I-R,PIT,CB
Keion Adams,Adams has a shoulder injury and is on the injured reserve list.,Shoulder,I-R,PIT,LB
Obi Melifonwu,Melifonwu has been placed on injured reserve after undergoing surgery to repair a knee injury but is expected to return Week 9 against the Dolphins.,Knee,I-R,OAK,S
Khalil Mack,Mack is battling a knee injury but it is not expected to impede his status for Sunday's game against the Titans.,Knee,probable,OAK,DE
Amari Cooper,Cooper is expected to suit up for the season opener against the Titans despite a knee injury.,Knee,probable,OAK,WR
Cory James,James is nursing a knee injury and it is unclear if he will play Sunday against the Titans.,Knee,questionable,OAK,LB
Gareon Conley,Conley is dealing with shin splints and it is unclear if he will make his NFL debut against the Titans on Sunday.,Shin,questionable,OAK,CB
Kelechi Osemele,Osemele is hampered by injuries to his wrist and ankle. It is uncertain if he will be available against the Titans on Sunday.,Wrist,questionable,OAK,OL
Sebastian Janikowski,Janikowski has a back injury and it is unknown if he will perform in the season opener against the Titans.,Back,questionable,OAK,K
Jamize Olawale,Olawale is hampered by a leg injury and his availability against the Titans in the season opener is undecided.,Leg,questionable,OAK,FB
Denver Kirkland,Kirkland has landed on injured reserve due to a leg injury and it is undetermined if he will be activated against the Bills during Week 8.,Leg,I-R,OAK,G
David Amerson,Amerson is going through concussion protocol but is expected to be ready for Sunday's game against the Titans.,Concussion,probable,OAK,CB
Keith McGill,McGill will have surgery to repair a Jones fracture and is expected to miss an extended amount of time.,Toe,out,OAK,DB
Aldon Smith,Smith remains suspended for an undetermined amount of time for violating the league's substance-abuse program.,Suspension,out,OAK,LB
Cooper Kupp,Kupp is dealing with a groin strain but is expected to play in the season opener against the Colts.,Groin,probable,LAR,WR
Aaron Donald,Donald is away from the team and is not participating in any football activities and he is unsatisfied with the current status of his contract. It is undetermined as to when he will rejoin the club.,Holdout,out,LAR,DT
Tavon Austin,Austin is dealing with a hamstring injury but is likely to play in the season opener against the Colts.,Hamstring,probable,LAR,WR
Temarrick Hemingway,Hemingway sustained a fractured fibula and is on injured reserve.,Shin,I-R,LAR,TE
Troy Hill,Hill has been issued a two-game suspension for violating the league's substance abuse policy but is expected to return September 21 against the 49ers.,Suspension,out,LAR,CB
Mike Thomas,Thomas has been suspended four games for violating the league's policy on performance-enhancing drugs. He will be eligible to return against the Seahawks in Week 5.,Suspension,out,LAR,WR
Lance Dunbar,Dunbar has been placed on the PUP list with a knee injury and will miss the first six weeks of the 2017 season.,Knee,I-R,LAR,RB
Bradley Marquez,Marquez is on injured reserve with a knee injury.,Knee,I-R,LAR,WR
Dominique Easley,Easley has landed on the injured reserve list due to a torn ACL.,Knee,I-R,LAR,DT
Danny Woodhead,Woodhead is likely to take part in Sunday's game against the Bengals despite a hamstring injury.,Hamstring,probable,BAL,RB
Jeremy Maclin,Maclin is expected to participate in the season opener against the Bengals despite a hand injury.,Hand,probable,BAL,WR
Jaylen Hill,"Hill is dealing with an injured thigh, leaving his availability in question against the Bengals on Sunday.",Thigh,questionable,BAL,CB
Joe Flacco,Flacco is expected to be ready for the season opener against the Bengals despite being bothered by stiffness in his back.,Back,probable,BAL,QB
Maxx Williams,Williams is recovering from offseason knee surgery and is not expected to be ready for the season opener against the Bengals.,Knee,doubtful,BAL,TE
Sheldon Price,Price is experiencing concussion-like symptoms and his availability for Sunday's game against the Bengals is unknown.,Concussion,questionable,BAL,CB
Breshad Perriman,Perriman is nursing a hamstring injury but is expected to suit up for Sunday's game against the Bengals.,Hamstring,probable,BAL,WR
Maurice Canady,Canady suffered a knee injury and is on injured reserve. It is unclear if he will be activated against the Titans during Week 9.,Knee,I-R,BAL,CB
Brandon Boykin,Boykin has landed on injured reserve due to an undefined injury.,Undisclosed,I-R,BAL,CB
Tavon Young,Young is on the injured reserve list with a torn ACL and will miss the entire 2017 season.,Knee,I-R,BAL,CB
Albert McClellan,McClellan has been placed on the injured reserve with a torn ACL.,Knee,I-R,BAL,LB
Alex Lewis,Lewis had surgery to repair a shoulder injury and is on the injured reserve list.,Shoulder,I-R,BAL,G
Kenneth Dixon,Dixon had season-ending surgery to repair his medial meniscus and has been issued a four-game suspension for violating the league's policy on performance-enhancing drugs.,Knee,I-R,BAL,RB
Tim White,White has been placed on the injured reserve with a thumb injury.,Thumb,I-R,BAL,WR
Nico Siragusa,Siragusa has been placed on the injured reserve with a torn ACL in his left knee.,Knee,I-R,BAL,G
Darren Waller,Waller has been suspended for at least one year for violating the league's substance-abuse policy.,Suspension,out,BAL,TE
Crockett Gillmore,Gillmore has been placed on the injured reserve list with after having MCL surgery.,Knee,I-R,BAL,TE
Tyrell Williams,Williams is battling a groin injury but is likely to suit up for the season opener against the Broncos.,Groin,probable,SDG,WR
Sean McGrath,McGrath is nursing a knee injury and it is unclear if he will play against the Broncos in the season opener.,Knee,questionable,SDG,TE
Dontrelle Inman,"Inman is dealing with a groin injury, leaving his status unclear for Monday's game against the Broncos.",Groin,questionable,SDG,WR
Denzel Perryman,Perryman had surgery to fix a torn ligament in his ankle and is on the injured reserve list. It is unknown if he will play Week 10 against the Jaguars.,Ankle,I-R,SDG,LB
Forrest Lamp,Lamp sustained a torn ACL in his right knee and is on the injured reserve list.,Knee,I-R,SDG,G
Mike Williams,Williams is recovering from an offseason back injury and is expected to remain out of action until Week 4 against the Eagles or Week 5 against the Giants.,Back,out,SDG,WR
Tenny Palepoi,Palepoi has one game remaining on a four-game suspension for violating the league's policy on performance-enhancing drugs last season and will miss the season opener against the Broncos.,Suspension,out,SDG,DT
Chris Landrum,Landrum is on the injured reserve list with a shoulder injury.,Shoulder,I-R,SDG,DE
Max Tuerk,Turek has been issued a four-game suspension for violating the league's PED policy but is likely to make his season debut during Week 5 against the Giants.,Suspension,out,SDG,C
Charmeachealle Moore,Moore has been designated for injured reserve with an unspecified injury.,Undisclosed,I-R,SDG,LB
Jeremiah Attaochu,Attaochu has a pulled hamstring and his status going forward is week-to-week.,Hamstring,out,SDG,DE
Asante Cleveland,Cleveland has been placed on injured reserve due to a right knee injury.,Knee,I-R,SDG,TE
Delano Hill,Hill has a shoulder injury and it is uncertain if he will partake in the season opener against the Packers.,Shoulder,questionable,SEA,S
Michael Wilhoite,Wilhoite is dealing with a calf injury and his status for Sunday's game against the Packers is in question.,Calf,questionable,SEA,LB
Thomas Rawls,Rawls is bothered by an ankle injury but is expected to take part in the season opener against the Packers.,Ankle,probable,SEA,RB
C.J. Prosise,Prosise has a groin injury but is expected to suit up for the season opener against the Packers.,Groin,probable,SEA,RB
Cliff Avril,Avril is recuperating from offseason abdominal surgery but is expected to be ready for the start of the 2017 season.,Abdominal,probable,SEA,DE
Tanner McEvoy,McEvoy had surgery to repair a toe injury and it is unknown as to if he will play against the Packers in the season opener.,Toe,questionable,SEA,WR
Tyler Lockett,Lockett will undergo Regenokine treatment on his leg but is expected to take part in Sunday's game against the Packers.,Leg,probable,SEA,WR
Frank Clark,Clark has an injured wrist but is expected to suit up for Sunday's game against the Packers.,Wrist,probable,SEA,DE
Paul Richardson,Richardson has been diagnosed with an AC joint sprain in his shoulder but is expected to be ready to face the Packers in the season opener.,Shoulder,probable,SEA,WR
George Fant,Fant suffered a torn ACL in his right knee and is on the injured reserve list.,Knee,I-R,SEA,T
Marcus Cromartie,Cromartie is on the injured reserve list with a soft-tissue injury in his leg.,Leg,I-R,SEA,S
DeShawn Shead,Shead underwent surgery to repair the torn ACL in his left knee and is on the Pup list. It is undetermined if he will return during Week 8 against the Texans.,Knee,I-R,SEA,CB
DeAndre Elliott,Elliott has a right ankle injury and is on the injured reserve list.,Ankle,I-R,SEA,CB
Malik McDowell,McDowell has landed on the Injured Reserve/Non-Football Injury list with a concussion and facial fractures. His status for October 29 against the Texans is clouded.,Concussion,I-R,SEA,DT
Dion Jordan,Jordan had an operation to repair a knee injury and is on the Injured Reserve/Non-Football Injury list. It is unclear if he will return October 29 against the Texans.,Knee,I-R,SEA,DE
Aaron Lynch,"Lynch is dealing with a back injury, leaving his status unclear against the Panthers on Sunday.",Back,questionable,SFO,LB
Jimmie Ward,Ward is nursing a hamstring injury and it is undetermined if he will partake in the season opener against the Panthers.,Hamstring,questionable,SFO,DB
George Kittle,Kittle aggravated a hamstring injury during practice and his status against the Panthers on Sunday is in question.,Hamstring,questionable,SFO,TE
Aaron Burbridge,Burbridge has landed on injured reserve with a hamstring injury.,Hamstring,I-R,SFO,WR
Don Jones,Jones has been designated for injured reserve with a torn ACL in his left knee.,Knee,I-R,SFO,DB
Joshua Garnett,Garnett had a procedure performed on his knee and is on the injured reserve list.,Knee,I-R,SFO,G
Ronald Blair,Blair III has been designated for injured reserve with a thumb injury.,Thumb,I-R,SFO,DL
