Joe Barksdale,Barksdale was forced from the last game due to cramping in his left leg and his status is unknown for Week 6 against the Raiders.,Leg,questionable,LAC,T
Jeremiah Attaochu,Attaochu has missed the last two games with a pulled hamstring and his availability for Week 6 against the Saints is undecided.,Hamstring,questionable,LAC,DE
Branden Oliver,Oliver missed the previous game with a hamstring injury and it is uncertain if he will play Week 6 against the Raiders.,Hamstring,questionable,LAC,RB
Mike Williams,Williams is recovering from an offseason back injury and it is undetermined if he will make his season debut Week 6 against the Saints.,Back,questionable,LAC,WR
Chris Landrum,Landrum is on the injured reserve list with a shoulder injury.,Shoulder,I-R,LAC,DE
Charmeachealle Moore,Moore has been designated for injured reserve with an unspecified injury.,Undisclosed,I-R,LAC,LB
Asante Cleveland,Cleveland has been placed on injured reserve due to a right knee injury.,Knee,I-R,LAC,TE
Dewey McDonald,McDonald tore his ACL in his knee and is on the injured reserve list.,Knee,I-R,SEA,LB
George Fant,Fant suffered a torn ACL in his right knee and is on the injured reserve list.,Knee,I-R,SEA,T
DeAndre Elliott,Elliott has a right ankle injury and is on the injured reserve list.,Ankle,I-R,SEA,CB
DeShawn Shead,Shead underwent surgery to repair the torn ACL in his left knee and is on the Pup list. It is undetermined if he will return during Week 8 against the Texans.,Knee,I-R,SEA,CB
C.J. Prosise,Prosise has missed the past two games with an ankle injury but is expected to take part in Week 7 against the Giants.,Ankle,probable,SEA,RB
Luke Joeckel,Joeckel will undergo knee surgery and is expected to miss two-to-four weeks.,Knee,out,SEA,G
Michael Bennett,Bennett has soreness in his foot and his status for Week 7 against the Giants is in question.,Foot,questionable,SEA,DE
Jeremy Lane,Lane sat out the last game due to a hip injury and it is unclear if he will play Week 7 against the Giants.,Hip,questionable,SEA,WR
Dion Jordan,Jordan had an operation to repair a knee injury and is on the Injured Reserve/Non-Football Injury list. It is unclear if he will return November 5 against the Redskins.,Knee,I-R,SEA,DE
Quinton Jefferson,Jefferson broke his hand and is expected to miss four weeks as a result.,Hand,out,SEA,DT
Malik McDowell,McDowell has landed on the Injured Reserve/Non-Football Injury list with a concussion and facial fractures. His status for November 5 against the Redskins is clouded.,Concussion,I-R,SEA,DT
Chris Carson,Carson has landed on the injured reserve list due to a fracture just below his left knee.,Knee,I-R,SEA,RB
Cliff Avril,Avril sustained a serious stinger causing numbness down his arm and his status going forward is week-to-week.,Stinger,out,SEA,DE
Ronald Blair,Blair III has been designated for injured reserve with a thumb injury.,Thumb,I-R,SFO,DL
Chris Jones,Jones is dealing with an unspecified injury and is on injured reserve.,Undisclosed,I-R,SFO,DL
Joshua Garnett,Garnett had a procedure performed on his knee and is on the injured reserve list.,Knee,I-R,SFO,G
Aaron Burbridge,Burbridge has landed on injured reserve with a hamstring injury.,Hamstring,I-R,SFO,WR
Don Jones,Jones has been designated for injured reserve with a torn ACL in his left knee.,Knee,I-R,SFO,DB
Reuben Foster,Foster is sidelined with a right high-ankle sprain and it is unclear if he will return to the lineup against the Redskins in Week 6.,Ankle,questionable,SFO,LB
Dekoda Watson,Watson missed the last game due to a groin injury and it is uncertain if he will suit up Week 6 against the Redskins.,Groin,questionable,SFO,LB
Rashard Robinson,Robinson left the last game with cramping to an unannounced location and it is undetermined if he will suit up against the Redskins during Week 6.,Undisclosed,questionable,SFO,CB
Asa Jackson,Jackson exited the previous game with a hamstring injury and it is unknown if he will play against the Redskins in Week 6.,Hamstring,questionable,SFO,CB
Adrian Colbert,Colbert was held out of the previous game due to an injured hamstring and it is undetermined if he will participate in Week 6 against the Redskins.,Hamstring,questionable,SFO,DB
Ahkello Witherspoon,Witherspoon left the last game with a concussion and it is unclear if he will play Week 6 against the Redskins.,Head,questionable,SFO,CB
Eric Reid,Reid suffered an injury to the PCL in his left knee and it is uncertain if he will return to action against the Redskins during Week 6.,Knee,questionable,SFO,S
Tank Carradine,Carradine is on the injured reserve list due to a right high-ankle sprain and it is unknown if he will be activated November 26 against the Seahawks.,Ankle,I-R,SFO,DL
Donavin Newsom,Newsom has been diagnosed with a concussion and is on the injured reserve list.,Concussion,I-R,SFO,LB
Chanceller James,James is on injured reserve with a knee injury.,Knee,I-R,SFO,S
Malcolm Smith,Smith sustained a torn pectoral muscle and is on the injured reserve list.,Pectoral,I-R,SFO,LB
Jimmie Gilbert,Gilbert has been placed on injured reserve due to a torn ACL.,Knee,I-R,SFO,LB
Lavonte David,David suffered a left medial-ankle sprain and is expected to be out of action for at least one month.,Knee,out,TAM,LB
Ryan Griffin,Griffin has been placed on the injured reserve list due to a sprained AC joint in his shoulder and it is unclear if he will play Week 9 against the Saints.,Shoulder,I-R,TAM,QB
Stevie Tu'ikolovatu,Tu'ikolovatu has been placed on the injured reserve with an injured MCL and meniscus in his right knee.,Knee,I-R,TAM,DT
DaVonte Lambert,Lambert has been placed on the injured reserve with a dislocated wrist.,Wrist,I-R,TAM,DL
Nick Folk,Folk has been placed on the injured reserve list due to tendinitis in his plant leg.,Leg,I-R,TAM,K
Ryan Russell,Russell is expected to require two-to-four weeks to recover from a dislocated left shoulder.,Shoulder,out,TAM,DE
Robert McClain,McClain exited the last game with a right foot injury and his status for Week 6 against the Cardinals is hazy.,Foot,questionable,TAM,CB
DeSean Jackson,"Jackson hurt his right forearm in the last game, leaving his status unclear for the Week 6 matchup against the Cardinals.",Forearm,questionable,TAM,WR
Kwon Alexander,Alexander has been held out of the past three games with a hamstring injury and it is undetermined if he will return against the Cardinals during Week 6.,Hamstring,questionable,TAM,LB
Keith Tandy,Tandy missed his second-straight game due to an injured hip and it is unknown if he will play against the Cardinals in Week 6.,Hip,questionable,TAM,S
Josh Robinson,Robinson departed the last game with a concussion and it is unknown if he will be cleared in time for Week 6 against the Cardinals.,Concussion,questionable,TAM,CB
T.J. Ward,Ward has sat out the last two games due to a hip injury and it is uncertain if he will be in the lineup Week 6 against the Cardinals.,Hip,questionable,TAM,S
Justin Trattou,Trattou has landed on the injured reserve list with an unspecified ailment.,Undisclosed,I-R,TAM,DE
Ty Nsekhe,Nsekhe underwent surgery for a core muscle injury and is expected to miss three-to-six weeks.,Abdominal,out,WAS,T
Su'a Cravens,Cravens had offseason surgery to trim the meniscus in his knee and is on the Injured Reserve/Left Squad list.,Knee,I-R,WAS,S
Phil Taylor,Taylor Sr. has a quadriceps injury and is on the injured reserve list.,Quadricep,I-R,WAS,DL
DeAngelo Hall,Hall is on the PUP list while recuperating from surgery to repair a torn ACL in his knee and it is unclear if he will be activated October 29 against the Cowboys.,Knee,I-R,WAS,S
Jonathan Allen,"Allen has a shoulder injury, leaving his status in question for Week 6 against the 49ers.",Shoulder,questionable,WAS,DL
Trent Williams,Williams exited the previous game due to an injury to his right kneecap but it is not expected to hinder his availability for Week 6 against the 49ers.,Knee,probable,WAS,T
Josh Norman,Norman will likely miss two-to-four weeks after fracturing a rib and damaging the lining of his lung.,Ribs,out,WAS,CB
Josh Doctson,Doctson has a shoulder injury but is likely to be available for Week 6 against the 49ers.,Shoulder,probable,WAS,WR
Martrell Spaight,Spaight suffered an injury to his ribs in the last game and it is unknown if he will play against the 49ers in Week 6.,Ribs,questionable,WAS,LB
Quinton Dunbar,Dunbar left the previous game with a left calf injury and his status is unclear against the 49ers in Week 6.,Calf,questionable,WAS,CB
Robert Kelley,Kelley is expected to suit up against the 49ers in Week 6 despite sustaining an ankle injury in the last game.,Ankle,probable,WAS,RB
Deshazor Everett,Everett was lifted from the last game with a hamstring injury and his availability against the 49ers in Week 6 is unclear.,Hamstring,questionable,WAS,S
Kevin Bowen,Bowen is on injured reserve with a left ankle injury.,Ankle,I-R,WAS,T
Trent Murphy,Murphy suffered an ACL and MLC tear and will spend the entire 2017 season on the injured reserve list.,Knee,I-R,WAS,LB
Keith Marshall,Marshall has been placed on injured reserve after having surgery to repair a torn right patellar tendon.,Knee,I-R,WAS,RB
