Ashton Lampkin,Lampkin has been designated for the injured reserve list due to a torn ACL.,Knee,I-R,KAN,DB
Dadi Nicolas,Nicolas has landed on the PUP list with a knee injury and it is unknown if he will be activated against the Raiders on October 19.,Knee,I-R,KAN,LB
Spencer Ware,Ware had season-ending surgery for a torn PCL and LCL in his right knee. He is on the injured reserve list as a result.,Knee,I-R,KAN,RB
Tamba Hali,Hali has been placed on the PUP list with a knee injury and it is uncertain if he will return October 19 against the Raiders.,Knee,I-R,KAN,LB
Jay Ajayi,Ajayi is expected to suit up Sunday against the Chargers despite a back injury.,Back,probable,MIA,RB
Rey Maualuga,Maualuga is dealing with a conditioning issue and his status is unclear against the Chargers on Sunday.,Conditioning,questionable,MIA,LB
Ted Larsen,Larsen tore his biceps and is on injured reserve.,Bicep,I-R,MIA,C
Rashawn Scott,Scott has been designated for the PUP list due to a foot injury and it is uncertain if he will be activated October 22 against the Jets.,Foot,I-R,MIA,WR
Raekwon McMillan,McMillan tore his ACL and is on the injured reserve list.,Knee,I-R,MIA,LB
Tony Lippett,Lippett has been designated for injured reserve due to a torn Achilles.,Achilles,I-R,MIA,CB
T.J. McDonald,McDonald has been handed an eight-game suspension for violating the league's substance abuse policy but is expected to make his season debut November 5th against the Raiders.,Suspension,out,MIA,S
Koa Misi,Misi has landed on injured reserve with a neck injury.,Neck,I-R,MIA,LB
Isaiah Ford,Ford has been placed on the injured reserve with a knee injury.,Knee,I-R,MIA,WR
Ryan Tannehill,Tannehill suffered a partially torn ACL in his right knee and is on the injured reserve list.,Knee,I-R,MIA,QB
Lamin Barrow,Barrow has been placed on the injured reserve list with a foot injury.,Foot,I-R,MIA,LB
Emmanuel Lamur,Lamur has a hamstring injury and it is unknown if he will play against the Steelers on Sunday.,Hamstring,questionable,MIN,LB
Tramaine Brock,Brock was held out of the previous game with a groin injury but is likely to be availabile against the Steelers on Sunday.,Groin,probable,MIN,DB
Sam Bradford,Bradford is expected to be available Sunday against the Steelers despite a knee injury.,Knee,probable,MIN,QB
Danny Isidora,Isidora sat out the last game due to a knee injury but is expected to play against the Steelers on Sunday.,Knee,probable,MIN,G
Anthony Barr,Barr is dealing with an injured hamstring and it is unclear if he will suit up against the Steelers on Sunday.,Hamstring,questionable,MIN,LB
Xavier Rhodes,Rhodes left the previous game due to a heat-related illness and his status for Sunday's contest against the Steelers is in question.,Illness,questionable,MIN,CB
Sharrif Floyd,Floyd has landed on the Injured Reserve/Non-Football Injury list as he is recuperating from meniscus surgery that took place last season and team officials are concerned that it could be career-threatening as he is experiencing complications in his recove,Knee,I-R,MIN,DT
Teddy Bridgewater,Bridgewater is on the PUP list while recovering from a dislocated knee and torn ACL and will miss the first six weeks of the 2017 season.,Knee,I-R,MIN,QB
Michael Floyd,Floyd has been suspended four games for violating the league's policy on performance-enhancing drugs. He will be eligible to join the team against the Bears in Week 5.,Suspension,out,MIN,WR
Bishop Sankey,Sankey has been placed on the injured reserve list with a knee injury.,Knee,I-R,MIN,RB
Jon Dorenbos,Dorenbos underwent heart surgery to repair an aortic aneuysm and is on the Injured Reserve/Non-Football Injury list.,Heart,I-R,NOR,LS
Zach Strief,Strief suffered a sprained MCL in his left knee and is expected to miss two-to-three weeks.,Knee,out,NOR,T
Terron Armstead,Armstead was absent from the lineup during the last game while he recovers from surgery to repair a torn labrum and it is undetermined if he will play Sunday against the Patriots.,Shoulder,questionable,NOR,T
Nathan Stupar,Stupar was held out of the last game with an injured hamstring and his availability against the Patriots on Sunday is uncertain.,Hamstring,questionable,NOR,LB
Trey Hendrickson,Hendrickson sat out the last game due to an illness and it is unclear if he will suit up against the Patriots on Sunday.,Illness,questionable,NOR,DE
Delvin Breaux,Breaux is on the injured reserve list with a fractured fibula in his left leg and it is uncertain if he will return Week 9 against the Buccaneers.,Leg,I-R,NOR,CB
Willie Snead,Snead IV has been issued a three-game suspension for violating the league's policy on substance of abuse but is expected to return October 1 against the Dolphins.,Suspension,out,NOR,WR
Corey Fuller,Fuller has been placed on the injured reserve with an undisclosed injury.,Undisclosed,I-R,NOR,WR
Nick Fairley,Fairley has been placed on the Injured Reserve/Non-Football Illness list due to a heart condition.,Heart,I-R,NOR,DT
Dan Arnold,Arnold is on the injured reserve list with an unspecified ailment.,Undisclosed,I-R,NOR,WR
Stephone Anthony,Anthony is hampered by a high-ankle sprain and is expected to miss three weeks.,Ankle,out,NOR,LB
Clay Harbor,Harbor is on injured reserve with an unspecified injury.,Undisclosed,I-R,NOR,TE
Demarcus Lawrence,Lawrence has landed on the Injured Reserve/Non-Football Injury list while he recuperates from a previous ACL surgery.,Knee,I-R,NOR,DE
Martin Wallace,Wallace has been designated for injured reserve with an unspecified injury.,Undisclosed,I-R,NOR,T
Adam Butler,Butler has a knee injury and it is unclear if he will play Sunday against the Saints.,Knee,questionable,NWE,DL
Marcus Cannon,Cannon is dealing with an ankle injury and it is unknown if he will play against the Saints on Sunday.,Ankle,questionable,NWE,OL
Danny Amendola,Amendola has a concussion and a knee injury. His status for Sunday's game against the Saints is in question.,Concussion,questionable,NWE,WR
Devin McCourty,McCourty is nursing a groin injury and it is undetermined if he will suit up against the Saints on Sunday.,Groin,questionable,NWE,DB
Matt Slater,Slater was held out of the last game due to a hamstring injury and it is undecided if he will be available for Sunday's matchup against the Saints.,Hamstring,questionable,NWE,WR
Dont'a Hightower,Hightower was forced from previous game due to an MCL sprain in his right knee and his status is unclear against the Saints on Sunday.,Knee,questionable,NWE,LB
Cameron Fleming,Fleming missed the last game due to an ankle injury and it is unclear if it will prevent him from playing on Sunday against the Saints.,Ankle,questionable,NWE,OL
Nate Ebner,Ebner was absent from the lineup during the last game due to an injured shoulder and his availability for Sunday's contest against the Saints is in question.,Shoulder,questionable,NWE,DB
Vincent Valentine,Valentine sat out the previous game with a knee injury and it is unknown if he will play against the Saints on Sunday.,Knee,questionable,NWE,DT
Harvey Langi,Langi sat out the previous game to a concussion and it is uncertain if he will be active against the Saints on Sunday.,Concussion,questionable,NWE,LB
Malcolm Mitchell,Mitchell is hampered by a knee injury and is on the injured reserve list. It is undetermined if he will be activated Week 10 against the Broncos.,Knee,I-R,NWE,WR
Shea McClellin,McClellin has been placed on the injured reserve list with an unspecified injury.,Undisclosed,I-R,NWE,LB
Keionta Davis,Davis has been designated for injured reserve as he is recovering from a bulging disc in his neck.,Neck,I-R,NWE,DL
Cyrus Jones,Jones suffered a torn ACL in his right knee and is on injured reserve as a result.,Knee,I-R,NWE,CB
Andrew Jelks,Jelks has landed on the Injured Reserve/Non-Football Injury list due to a knee injury and it is uncertain if he will be activated October 22 against the Falcons.,Knee,I-R,NWE,OL
Antonio Garcia,Garcia has landed on the Injured Reserve/Non-Football Illness list with an unspecified illness.,Illness,I-R,NWE,OL
Julian Edelman,Eldeman tore the ACL in his right knee and is on the injured reserve list.,Knee,I-R,NWE,WR
Derek Rivers,Rivers is on injured reserve after suffering a torn ACL in his left knee.,Knee,I-R,NWE,DE
Odell Beckham,Beckham Jr. was held out of the previous game with a sprained left ankle but is expected to make his season debut against the Lions on Monday.,Ankle,probable,NYG,WR
Janoris Jenkins,Jenkins is expected to suit up against the Lions on Monday despite a hand injury.,Hand,probable,NYG,CB
Bobby Hart,Hart sprained his ankle in the season opener but is likely available for Monday's game against the Lions.,Ankle,probable,NYG,G
Keenan Robinson,Robinson missed the last game with a concussion and it is unknown if he will be available against the Lions on Monday.,Concussion,questionable,NYG,LB
Tavarres King,King sat out the last game with an ankle injury and it is uncertain if he will participate in Monday's contest against the Lions.,Ankle,questionable,NYG,WR
Mark Herzlich,Herzlich is battling a stinger and is on injured reserve.,Stinger,I-R,NYG,LB
Josh Banks,Banks has been placed on the injured reserve list with a shoulder injury.,Shoulder,I-R,NYG,DT
Evan Schwan,Schwan has been designated for the injured reserve list with a broken foot.,Foot,I-R,NYG,DE
Adam Gettis,Gettis has been placed on the injured reserve list with a foot injury.,Foot,I-R,NYG,T
Antwon Blake,Blake is away from the team tending to a personal matter and will miss an undetermined amount of time.,Personal,out,NYG,CB
Keeon Johnson,Johnson has been placed on the injured reserve with a broken foot.,Foot,I-R,NYG,WR
Corbin Bryant,Bryant has landed on injured reserve with a dislocated elbow.,Elbow,I-R,NYG,DT
Kevin Norwood,Norwood has been designated for injured reserve due to a hip injury.,Hip,I-R,NYG,WR
Ishaq Williams,Williams has been placed on injured reserve while he recovers from offseason knee surgery.,Knee,I-R,NYG,DE
Morris Claiborne,Claiborne has an ankle injury and it is unclear if he will play Sunday against the Raiders.,Ankle,questionable,NYJ,CB
Edmond Robinson,Robinson is dealing with a groin injury and it is unknown if he will play against the Raiders on Sunday.,Groin,questionable,NYJ,CB
Bruce Carter,Carter left the previous game with an ankle injury and his status Sunday against the Raiders is unclear.,Ankle,questionable,NYJ,LB
Bryce Petty,Petty has been diagnosed with a Grade 1 MCL sprain in his left knee and his status Sunday against the Raiders is unclear.,Knee,questionable,NYJ,QB
Eric Tomlinson,Tomlinson left the last game with an elbow injury and his availability for Sunday's tilt against the Raiders is unknown.,Elbow,questionable,NYJ,TE
Rontez Miles,Miles missed the previous game with an eye injury and his availability for Sunday's game against the Raiders is unclear.,Eye,questionable,NYJ,S
Jordan Leggett,Leggett missed the previous game with a knee injury and his status against the Raiders on Sunday is not clear.,Knee,questionable,NYJ,TE
Lorenzo Mauldin,Mauldin has a back injury and is on injured reserve. It is undetermined if he will return Week 9 against the Bills.,Back,I-R,NYJ,LB
Jalin Marshall,Marshall is serving a four-game suspension for violating the league's policy on PED's but is likely to be available October 8 against the Browns.,Suspension,out,NYJ,WR
Chris Gragg,Gragg has been placed on the injured reserve with a knee injury.,Knee,I-R,NYJ,TE
Brisly Estime,Estime has landed on injured reserve due to a torn Achilles tendon.,Achilles,I-R,NYJ,WR
Devin Smith,Smith has been placed on the injured reserve list while he recovers from a torn ACL.,Knee,I-R,NYJ,WR
Jeremy Clark,Clark has been placed on the Injured Reserve/Non-Football Injury list with a knee injury.,Knee,I-R,NYJ,CB
Anthony Johnson,Johnson has been designated for the injured reserve list due to a stinger.,Stinger,I-R,NYJ,DL
Quincy Enunwa,Enunwa has been placed on the injured reserve list after having surgery to repair a bulging disc in his neck.,Neck,I-R,NYJ,WR
Doug Middleton,Middleton sustained a torn pectoral muscle and is on the injured reserve list.,Pectoral,I-R,NYJ,S
Bryson Keeton,Keeton has been placed on the injured reserve list with a torn ACL.,Knee,I-R,NYJ,CB
Tye Smith,Smith is dealing with a hand injury and it is unknown if he will play against the Jaguars on Sunday.,Hand,questionable,TEN,CB
Jonathan Cyprien,Cyprien sustained an injured hamstring and is likely to miss a two-three weeks.,Hamstring,out,TEN,S
LeShaun Sims,Sims sat out the last game with a groin injury but is likely active for Sunday's game against the Jaguars.,Groin,probable,TEN,CB
Jurrell Casey,Casey has a back injury and it is unclear if he will play Sunday against the Jaguars.,Back,questionable,TEN,DT
Wesley Woodyard,Woodyard is ailing from an illness and it is uncertain if he will suit up Sunday against the Jaguars.,Illness,questionable,TEN,LB
Kevin Dodd,Dodd missed the last game with a foot injury and it is unknown if he will suit up against the Jaguars on Sunday.,Foot,questionable,TEN,LB
Harry Douglas,Douglas has been designated for injured reserve due to a knee injury.,Knee,I-R,TEN,WR
Tajae Sharpe,Sharpe is on injured reserve due to a foot injury.,Foot,I-R,TEN,WR
Alex Tanney,Tanney has landed in the injured reserve list with a broken foot.,Foot,I-R,TEN,QB
Victor Ochi,Ochi has landed on the injured reserve list with a knee injury.,Knee,I-R,TEN,LB
Jason Peters,Peters is battling a groin injury but is expected to play against the Chiefs on Sunday.,Groin,probable,PHI,T
Destiny Vaeao,Vaeao left the last game with a wrist injury and it is uncertain if he will play against the Chiefs on Sunday.,Wrist,questionable,PHI,DT
Caleb Sturgis,Sturgis has landed on the injured reserve list wit ha strained quadriceps in his plant leg and will not be eligible to return until November 19 against the Cowboys.,Quadricep,I-R,PHI,K
Donnel Pumphrey,Pumphrey was held out of the previous game due to a head injury and it is undetermined if he will suit up against the Chiefs on Sunday.,Head,questionable,PHI,RB
Ronald Darby,Darby suffered a dislocated right ankle and is expected to miss four-to-six weeks.,Ankle,out,PHI,CB
Sidney Jones,Jones is on the Injured Reserve/Non-Football Injury list while he recovers from a torn Achilles' tendon and it is unknown if he will be activated for October 23rd's game against the Redskins.,Achilles,I-R,PHI,CB
Aziz Shittu,Shittu has been placed on the injured reserve list due to a knee injury.,Knee,I-R,PHI,DT
Dom Williams,Williams has been designated for injured reserve with an Achilles injury.,Achilles,I-R,PHI,WR
Randall Goforth,Goforth has landed on injured reserve with a torn ACL.,Knee,I-R,PHI,CB
Bud Dupree,Dupree was held out of the last game due to a shoulder injury but is expected to suit up on Sunday against the Vikings.,Shoulder,probable,PIT,LB
Jerald Hawkins,Hawkins was inactive in the previous game due to a knee injury and it is undecided if he will play against the Vikings on Sunday.,Knee,questionable,PIT,T
J.J. Wilcox,Wilcox was removed from the previous game after suffering a concussion and it is undetermined if he will play against the Vikings on Sunday.,Concussion,questionable,PIT,S
Stephon Tuitt,Tuitt suffered a biceps injury and his availability against the Vikings on Sunday has yet to be determined.,Bicep,questionable,PIT,DE
Cameron Sutton,Sutton has landed on the injured reserve with right hamstring injury and his availability for Week 10 against the Colts is uncertain.,Hamstring,I-R,PIT,CB
Keion Adams,Adams has a shoulder injury and is on the injured reserve list.,Shoulder,I-R,PIT,LB
Cory James,James has a knee injury and it is uncertain if he will play against the Jets on Sunday.,Knee,questionable,OAK,LB
Sean Smith,Smith is nursing a neck injury and it is undecided if he will be available Sunday against the Jets.,Neck,questionable,OAK,CB
Amari Cooper,Cooper was confined to a limited role in practice due to a knee injury but is expected to suit up Sunday against the Jets.,Knee,probable,OAK,WR
Gareon Conley,Conley sat out the previous game due to shin splints and it is unclear if he will play against the Jets on Sunday.,Shin,questionable,OAK,CB
Jamize Olawale,Olawale missed the last game with a quad injury and it is unknown if he will be available Sunday against the Jets.,Quadricep,questionable,OAK,FB
Sebastian Janikowski,Janikowski has been placed on the injured reserve list with a back injury and is first eligible to return November 5 against the Dolphins.,Back,I-R,OAK,K
Keith McGill,McGill will have surgery to repair a Jones fracture and is expected to miss an extended amount of time.,Foot,out,OAK,DB
Obi Melifonwu,Melifonwu has been placed on injured reserve after undergoing surgery to repair a knee injury but is expected to return Week 9 against the Dolphins.,Knee,I-R,OAK,S
Denver Kirkland,Kirkland has landed on injured reserve due to a leg injury and it is undetermined if he will be activated against the Bills during Week 8.,Leg,I-R,OAK,G
Aldon Smith,Smith remains suspended for an undetermined amount of time for violating the league's substance-abuse program.,Suspension,out,OAK,LB
Kayvon Webster,Webster left the last game due to a shoulder injury and it is unclear if he will play Sunday against the Redskins.,Shoulder,questionable,LAR,CB
Aaron Donald,Donald has ended his contract holdout and is expected to make his season debut Sunday against the Redskins.,Personal,probable,LAR,DT
Temarrick Hemingway,Hemingway sustained a fractured fibula and is on injured reserve.,Shin,I-R,LAR,TE
Troy Hill,Hill has been issued a two-game suspension for violating the league's substance abuse policy but is expected to return September 21 against the 49ers.,Suspension,out,LAR,CB
Mike Thomas,Thomas has been suspended four games for violating the league's policy on performance-enhancing drugs. He will be eligible to return against the Seahawks in Week 5.,Suspension,out,LAR,WR
Lance Dunbar,Dunbar has been placed on the PUP list with a knee injury and will miss the first six weeks of the 2017 season.,Knee,I-R,LAR,RB
Bradley Marquez,Marquez is on injured reserve with a knee injury.,Knee,I-R,LAR,WR
Dominique Easley,Easley has landed on the injured reserve list due to a torn ACL.,Knee,I-R,LAR,DT
Eric Weddle,"Weddle has a left leg injury, leaving his status for Sunday's tilt against the Browns up in the air.",Leg,questionable,BAL,S
Za'Darius Smith,Smith left the previous game with a knee injury and his status for Sunday's contest against the Browns is unclear.,Knee,questionable,BAL,LB
Sheldon Price,Price missed the previous game with a concussion and it is unknown if he will be available Sunday against the Browns.,Concussion,questionable,BAL,CB
Jaylen Hill,Hill missed the previous game due to a hamstring injury and his availability against the Browns on Sunday is unclear.,Hamstring,questionable,BAL,CB
Danny Woodhead,Woodhead aggravated a hamstring injury and will likely need six-to-eight weeks to recover.,Hamstring,out,BAL,RB
Maurice Canady,Canady suffered a knee injury and is on injured reserve. It is unclear if he will be activated against the Titans during Week 9.,Knee,I-R,BAL,CB
Brandon Boykin,Boykin has landed on injured reserve due to an undefined injury.,Undisclosed,I-R,BAL,CB
Alex Lewis,Lewis had surgery to repair a shoulder injury and is on the injured reserve list.,Shoulder,I-R,BAL,G
Tavon Young,Young is on the injured reserve list with a torn ACL and will miss the entire 2017 season.,Knee,I-R,BAL,CB
Tim White,White has been placed on the injured reserve with a thumb injury.,Thumb,I-R,BAL,WR
Nico Siragusa,Siragusa has been placed on the injured reserve with a torn ACL in his left knee.,Knee,I-R,BAL,G
Albert McClellan,McClellan has been placed on the injured reserve with a torn ACL.,Knee,I-R,BAL,LB
Kenneth Dixon,Dixon had season-ending surgery to repair his medial meniscus and has been issued a four-game suspension for violating the league's policy on performance-enhancing drugs.,Knee,I-R,BAL,RB
Darren Waller,Waller has been suspended for at least one year for violating the league's substance-abuse policy.,Suspension,out,BAL,TE
Crockett Gillmore,Gillmore has been placed on the injured reserve list with after having MCL surgery.,Knee,I-R,BAL,TE
Kenny Wiggins,Wiggins has an ankle injury but it is not expected to impede his status for Sunday's game against the Dolphins.,Ankle,probable,SDG,G
Dontrelle Inman,Inman missed the last game due to a groin injury but is likely to suit up Sunday against the Dolphins.,Groin,probable,SDG,WR
Jeremiah Attaochu,Attaochu has a pulled hamstring but is expected to play against the Dolphins on Sunday.,Hamstring,probable,SDG,DE
Sean McGrath,McGrath sat out the previous game due to a knee injury and it is unknown if he will play against the Dolphins on Sunday.,Knee,questionable,SDG,TE
Rayshawn Jenkins,Jenkins exited the last game with a concussion and his status against the Dolphins on Sunday is clouded.,Concussion,questionable,SDG,S
Max Tuerk,Turek has been issued a four-game suspension for violating the league's PED policy but is likely to make his season debut during Week 5 against the Giants.,Suspension,out,SDG,C
Denzel Perryman,Perryman had surgery to fix a torn ligament in his ankle and is on the injured reserve list. It is unknown if he will play Week 10 against the Jaguars.,Ankle,I-R,SDG,LB
Forrest Lamp,Lamp sustained a torn ACL in his right knee and is on the injured reserve list.,Knee,I-R,SDG,G
Mike Williams,Williams is recovering from an offseason back injury and is expected to remain out of action until Week 4 against the Eagles or Week 5 against the Giants.,Back,out,SDG,WR
Chris Landrum,Landrum is on the injured reserve list with a shoulder injury.,Shoulder,I-R,SDG,DE
Charmeachealle Moore,Moore has been designated for injured reserve with an unspecified injury.,Undisclosed,I-R,SDG,LB
Asante Cleveland,Cleveland has been placed on injured reserve due to a right knee injury.,Knee,I-R,SDG,TE
K.J. Wright,Wright is nursing an ankle injury and it is uncertain if he will be available against the 49ers on Sunday.,Ankle,questionable,SEA,LB
Richard Sherman,Sherman is expected to suit up Sunday against the 49ers despite a hamstring injury.,Hamstring,probable,SEA,CB
Shaquill Griffin,"Griffin is dealing with a concussion, leaving his status for Sunday's game against the 49ers clouded.",Concussion,questionable,SEA,CB
Terence Garvin,Garvin has a shoulder injury and it is unclear if he will play Sunday against the 49ers.,Shoulder,questionable,SEA,LB
Thomas Rawls,Rawls was held out of the previous game due to an ankle injury but is expected to play against the 49ers on Sunday.,Ankle,probable,SEA,RB
Cliff Avril,Avril left the last game due to a stinger and it is unclear if he will suit up Sunday against the 49ers.,Stinger,questionable,SEA,DE
Michael Wilhoite,Wilhoite sat out the last game with a calf injury and it is unclear if he will play Sunday against the 49ers.,Calf,questionable,SEA,LB
Delano Hill,Hill missed the last game due to a shoulder injury and it is unknown if he will partake in Sunday's contest against the 49ers.,Shoulder,questionable,SEA,S
Dion Jordan,Jordan had an operation to repair a knee injury and is on the Injured Reserve/Non-Football Injury list. It is unclear if he will return October 29 against the Texans.,Knee,I-R,SEA,DE
George Fant,Fant suffered a torn ACL in his right knee and is on the injured reserve list.,Knee,I-R,SEA,T
DeShawn Shead,Shead underwent surgery to repair the torn ACL in his left knee and is on the Pup list. It is undetermined if he will return during Week 8 against the Texans.,Knee,I-R,SEA,CB
Malik McDowell,McDowell has landed on the Injured Reserve/Non-Football Injury list with a concussion and facial fractures. His status for October 29 against the Texans is clouded.,Concussion,I-R,SEA,DT
DeAndre Elliott,Elliott has a right ankle injury and is on the injured reserve list.,Ankle,I-R,SEA,CB
George Kittle,"Kittle has a hamstring injury, leaving his status for Sunday's game against the Seahawks in question.",Hamstring,questionable,SFO,TE
Jimmie Ward,Ward was held out of the previous game due to a hamstring injury but is likely to available against the Seahawks on Sunday.,Hamstring,probable,SFO,DB
Aaron Lynch,Lynch missed the last game with a back injury and it is unknown if he will play against the Seahawks on Sunday.,Back,questionable,SFO,LB
Reuben Foster,Foster sustained a right high-ankle sprain and there is no timetable for recovery.,Ankle,out,SFO,LB
Chris Jones,Jones is dealing with an unspecified injury and is on injured reserve.,Undisclosed,I-R,SFO,DL
Joshua Garnett,Garnett had a procedure performed on his knee and is on the injured reserve list.,Knee,I-R,SFO,G
Aaron Burbridge,Burbridge has landed on injured reserve with a hamstring injury.,Hamstring,I-R,SFO,WR
Don Jones,Jones has been designated for injured reserve with a torn ACL in his left knee.,Knee,I-R,SFO,DB
Ronald Blair,Blair III has been designated for injured reserve with a thumb injury.,Thumb,I-R,SFO,DL
Donavin Newsom,Newsom has been diagnosed with a concussion and is on the injured reserve list.,Concussion,I-R,SFO,LB
Chanceller James,James is on injured reserve with a knee injury.,Knee,I-R,SFO,S
Malcolm Smith,Smith sustained a torn pectoral muscle and is on the injured reserve list.,Pectoral,I-R,SFO,LB
Jimmie Gilbert,Gilbert has been placed on injured reserve due to a torn ACL.,Knee,I-R,SFO,LB
BJ Johnson,Johnson has been designated for the injured reserve list due to a hamstring injury.,Hamstring,I-R,SFO,WR
Devante Bond,"Bond has a knee injury, leaving his status for Sunday's game against the Bears in question.",Knee,questionable,TAM,G
