Zach Ertz,Ertz sat out the previous game with a hamstring injury but is expected to be available Sunday against the Cowboys.,Hamstring,probable,PHI,TE
Dom Williams,Williams has been designated for injured reserve with an Achilles injury.,Achilles,I-R,PHI,WR
Aziz Shittu,Shittu has been placed on the injured reserve list due to a knee injury.,Knee,I-R,PHI,DT
Randall Goforth,Goforth has landed on injured reserve with a torn ACL.,Knee,I-R,PHI,CB
James Harrison,Harrison has been held out of the past two game with a back injury and it is uncertain if he will suit up against the Packers in Week 12.,Back,questionable,PIT,LB
Cameron Sutton,Sutton has landed on the IR/Designated for Return list with a right hamstring injury and it is undetermined if he will be activated for Week 12 against the Packers.,Hamstring,I-R,PIT,CB
Vance McDonald,McDonald missed the last game with an ankle injury and it is unclear if he will participate in Week 12 against the Packers.,Ankle,questionable,PIT,TE
Mike Mitchell,Mitchell sat out the previous game with an ankle injury and it is unknown if he will play Week 12 against the Packers.,Ankle,questionable,PIT,S
Joe Haden,Haden suffered a broken left fibula and is expected to be out of action for three-to-six weeks.,Leg,out,PIT,DB
Keion Adams,Adams has a shoulder injury and is on the injured reserve list.,Shoulder,I-R,PIT,LB
Antonio Hamilton,Hamilton has been placed on the injured reserve list with a knee injury is it unclear if he will return December 10 against the Chiefs.,Knee,I-R,OAK,CB
David Amerson,Amerson sat out his third-straight game due to foot and shoulder injuries. He is not expected to play in Sunday's matchup against the Patriots.,Foot,doubtful,OAK,CB
Marshall Newhouse,"Newhouse is nursing injuries to his hip and quadriceps, leaving his status against the Patriots on Sunday up in the air.",Hip,questionable,OAK,OL
Gabe Jackson,Jackson has an ankle injury and it is unclear if he will participate in Sunday's game against the Patriots.,Ankle,questionable,OAK,G
Cory James,James is dealing with a knee injury and it is unknown if he will take part in Sunday's contest against the Patriots.,Knee,questionable,OAK,LB
Sebastian Janikowski,Janikowski has been placed on the injured reserve list with a back injury and it is unknown if he will be activated prior to Sunday's game against the Patriots.,Back,I-R,OAK,K
Jamize Olawale,Olawale missed the last game due to a hamstring injury and it is unclear if he will play against the Patriots on Sunday.,Hamstring,questionable,OAK,FB
Denver Kirkland,Kirkland has landed on injured reserve due to a leg injury and it is undetermined if he will be activated against the Patriots on Sunday.,Leg,I-R,OAK,G
Gareon Conley,Conley has been designated for the injured reserve list due to lingering shin splints.,Shin,I-R,OAK,CB
Aldon Smith,Smith remains suspended for an undetermined amount of time for violating the league's substance-abuse program.,Suspension,out,OAK,LB
Temarrick Hemingway,Hemingway sustained a fractured fibula and is on injured reserve.,Shin,I-R,LAR,TE
Matt Longacre,Longacre is expected to take the field Sunday against the Vikings despite a back injury.,Back,probable,LAR,DE
Connor Barwin,Barwin will likely take part in Sunday's game against the Vikings despite a knee injury.,Knee,probable,LAR,LB
Lamarcus Joyner,Joyner is nursing a hip injury but is not expected to hinder his availability against the Vikings on Sunday.,Hip,probable,LAR,S
Robert Quinn,Quinn was absent from the lineup during the last game with an illness but is expected to take part in Sunday's matchup against the Vikings.,Illness,probable,LAR,LB
Troy Hill,Hill is dealing with a hamstring injury and it is unknown if he will play against the Vikings on Sunday.,Hamstring,questionable,LAR,CB
Rodger Saffold,Saffold is expected to play Sunday against the Vikings despite an ankle injury.,Ankle,probable,LAR,G
Derek Carrier,Carrier sat out the last game due to an injured hamstring and it is unclear if he will play Sunday against the Vikings.,Hamstring,questionable,LAR,TE
Malcolm Brown,Brown suffered an MCL injury and there is no timetable for return.,Knee,out,LAR,RB
Cody Davis,Davis has landed on injured reserve wit ha thigh injury and will be eligible to be activated December 31 against the 49ers.,Thigh,I-R,LAR,S
Dominique Easley,Easley has landed on the injured reserve list due to a torn ACL.,Knee,I-R,LAR,DT
Brent Urban,Urban suffered a lisfranc foot sprain and is on the injured reserve list.,Foot,I-R,BAL,DE
Marshal Yanda,Yanda has been placed on injured reserve with a fractured ankle.,Ankle,I-R,BAL,G
Bam Bradley,Bradley has been placed on the injured reserve list with a torn ACL in his knee.,Knee,I-R,BAL,LB
Brandon Boykin,Boykin has landed on injured reserve due to an undefined injury.,Undisclosed,I-R,BAL,CB
Tim White,White has been placed on the injured reserve with a thumb injury.,Thumb,I-R,BAL,WR
Nico Siragusa,Siragusa has been placed on the injured reserve with a torn ACL in his left knee.,Knee,I-R,BAL,G
Albert McClellan,McClellan has been placed on the injured reserve with a torn ACL.,Knee,I-R,BAL,LB
Alex Lewis,Lewis had surgery to repair a shoulder injury and is on the injured reserve list.,Shoulder,I-R,BAL,G
Tavon Young,Young is on the injured reserve list with a torn ACL and will miss the entire 2017 season.,Knee,I-R,BAL,CB
Kenneth Dixon,Dixon had season-ending surgery to repair his medial meniscus and is on the injured reserve list.,Knee,I-R,BAL,RB
Danny Woodhead,Woodhead has been activated from the IR/Designated for return list after recovering from a hamstring injury. He is expected to suit up Sunday against the Packers.,Hamstring,probable,BAL,RB
Ronnie Stanley,Stanley is in the concussion protocol and unlikely to be cleared in time for Sunday's game against the Packers.,Concussion,doubtful,BAL,T
Jeremy Maclin,Maclin was forced from the last game after aggravating a previous shoulder injury but is expected to be available against the Packers on Sunday.,Shoulder,probable,BAL,WR
Chuck Clark,Clark missed the last game due to a thigh injury but is expected to be available for Sunday's contest against the Packers.,Thigh,probable,BAL,S
Tim Williams,Williams has been held out of the previous four games due to a thigh injury but is likely to return against the Packers on Sunday.,Thigh,probable,BAL,LB
Terrance West,West is sidelined with a calf strain but is likely to return to the lineup against the Packers on Sunday.,Calf,probable,BAL,RB
Jimmy Smith,Smith has an Achilles injury and it is unclear if he will partake in Sunday's game against the Packers.,Achilles,questionable,BAL,CB
Michael Campanaro,Campanaro missed his second-straight game with a shoulder injury but is likely to play against the Packers on Sunday.,Shoulder,probable,BAL,WR
Nick Boyle,Boyle sat out the previous game due to an injured toe but is expected to play Sunday against the Packers.,Toe,probable,BAL,TE
Darren Waller,Waller has been suspended for at least one year for violating the league's substance-abuse policy.,Suspension,out,BAL,TE
Crockett Gillmore,Gillmore has been placed on the injured reserve list with after having MCL surgery.,Knee,I-R,BAL,TE
Jason Verrett,Verrett has been placed on the injured reserve list with a knee injury.,Knee,I-R,LAC,CB
Chris Hairston,Hairston has landed on the Injured Reserve/Non-Football Illness list with blood clots.,Illness,I-R,LAC,T
Forrest Lamp,Lamp sustained a torn ACL in his right knee and is on the injured reserve list.,Knee,I-R,LAC,G
Matt Slauson,Slauson is on the injured reserve list due to a torn biceps.,Bicep,I-R,LAC,C
Corey Liuget,Liuget is nursing an injured toe but is expected to take part in Sunday's contest against the Bills.,Toe,probable,LAC,DT
Joe Barksdale,Barksdale has missed the past three games due to a foot injury and will not return Sunday against the Bills.,Foot,out,LAC,T
Hayes Pullard,Pullard III missed the last game due to a neck injury and will likely be inactive against the Bills on Sunday.,Neck,doubtful,LAC,LB
James Onwualu,Onwualu is not expected to suit up against the Bills on Sunday due to a quadriceps injury.,Quadricep,doubtful,LAC,LB
Brandon Mebane,Mebane has been confined to a limited role in practice due to a hamstring injury but is expected to play in Sunday's game against the Bills.,Hamstring,probable,LAC,NT
Philip Rivers,Rivers has cleared the concussion protocol and is expected to start Sunday's game against the Bills.,Concussion,probable,LAC,QB
Spencer Pulley,Pulley is hampered by a knee injury and his status against the Bills on Sunday is in question.,Knee,questionable,LAC,C
Adrian Phillips,Phillips is battling a hamstring injury and it is undetermined if he will compete against the Bills on Sunday.,Hamstring,questionable,LAC,S
Chris McCain,McCain has a quadriceps injury and it is unclear if he will participate in Sunday's game against the Bills.,Quadricep,questionable,LAC,DE
Chris Landrum,Landrum is on the injured reserve list with a shoulder injury.,Shoulder,I-R,LAC,DE
Charmeachealle Moore,Moore has been designated for injured reserve with an unspecified injury.,Undisclosed,I-R,LAC,LB
Asante Cleveland,Cleveland has been placed on injured reserve due to a right knee injury.,Knee,I-R,LAC,TE
Dewey McDonald,McDonald tore his ACL in his knee and is on the injured reserve list.,Knee,I-R,SEA,LB
George Fant,Fant suffered a torn ACL in his right knee and is on the injured reserve list.,Knee,I-R,SEA,T
DeAndre Elliott,Elliott has a right ankle injury and is on the injured reserve list.,Ankle,I-R,SEA,CB
Cliff Avril,Avril sustained a neck injury causing numbness down his arm and is on the injured reserve list.,Neck,I-R,SEA,DE
Kam Chancellor,Chancellor is expected to miss the remainder of the season after suffering a neck injury.,Neck,out,SEA,S
Russell Wilson,Wilson is expected to take the field against the Falcons on Monday despite needing his jaw re-set.,Jaw,probable,SEA,QB
Frank Clark,Clark was lifted from the last game due to an injured thigh but is expected to be available against the Falcons on Monday.,Thigh,probable,SEA,DE
Michael Bennett,"Bennett has a heel injury, leaving his status unclear for Monday's game against the Falcons.",Heel,questionable,SEA,DE
Eddie Lacy,Lacy was held out of the last game due to a groin injury but is expected to line up against the Falcons on Monday.,Groin,probable,SEA,RB
Jimmy Graham,Graham is battling a lingering knee injury but is expected to suit up against the Falcons on Monday.,Knee,probable,SEA,TE
C.J. Prosise,Prosise has been placed on injured reserve with a sprained left ankle and will be eligible to return during the postseason.,Ankle,I-R,SEA,RB
Richard Sherman,Sherman suffered a ruptured right Achilles tendon and is on the injured reserve list.,Achilles,I-R,SEA,CB
Duane Brown,Brown was forced from the last game due to a sprained right ankle and it is undetermined if he will suit up against the Falcons on Monday.,Ankle,questionable,SEA,T
Jarran Reed,Reed was removed from the previous game with a right hamstring injury and it is uncertain if he will suit up Monday against the Falcons.,Hamstring,questionable,SEA,DT
Shaquill Griffin,"Griffin hurt his shoulder in the last game, leaving his availability unclear against the Falcons on Monday.",Shoulder,questionable,SEA,CB
Michael Wilhoite,Wilhoite exited the previous game with a calf injury and it is unclear if he will play Monday against the Falcons.,Calf,questionable,SEA,LB
Marcus Smith,Smith sat out the previous game as he is in the concussion protocol and it is unclear if he will be cleared in time for Monday's matchup against the Falcons.,Concussion,questionable,SEA,DE
Chris Carson,Carson has landed on the injured reserve list due to a fracture just below his left knee and also has a high-ankle sprain. It is undetermined if he will return for December 10 against the Jaguars.,Knee,I-R,SEA,RB
DeShawn Shead,Shead underwent surgery to repair the torn ACL in his left knee and is on the PUP list. It is undetermined if he will be activated prior to Monday's game against the Falcons.,Knee,I-R,SEA,CB
Malik McDowell,McDowell has landed on the Injured Reserve/Non-Football Injury list with a concussion and facial fractures. His status for Monday's contest against the Falcons is unknown.,Concussion,I-R,SEA,DT
Luke Joeckel,Joeckel underwent knee surgery and it is uncertain if he will return to action against the Falcons on Monday.,Knee,questionable,SEA,G
Earl Thomas,Thomas has been held out of the previous two game due to a strained hamstring but is likely to return to action against the Falcons on Monday.,Hamstring,probable,SEA,S
Rees Odhiambo,Odhiambo is dealing with injuries to both hands and is on the injured reserve list.,Hand,I-R,SEA,G
Tre Madden,"Madden has been placed on injured reserve with a calf injury, ending his season.",Calf,I-R,SEA,FB
Chris Jones,Jones is dealing with an unspecified injury and is on injured reserve.,Undisclosed,I-R,SFO,DL
Joshua Garnett,Garnett had a procedure performed on his knee and is on the injured reserve list.,Knee,I-R,SFO,G
Aaron Burbridge,Burbridge has landed on injured reserve with a hamstring injury.,Hamstring,I-R,SFO,WR
Don Jones,Jones has been designated for injured reserve with a torn ACL in his left knee.,Knee,I-R,SFO,DB
Garry Gilliam,Gilliam has landed on the injured reserve list with a knee injury.,Knee,I-R,SFO,OL
Jimmie Ward,Ward suffered a broken forearm and is on the injured reserve list.,Forearm,I-R,SFO,DB
Arik Armstead,Armstead is on injured reserve with a broken hand and it is unclear if he will be activated December 17 against the Titans.,Hand,I-R,SFO,DL
Asa Jackson,"Jackson has been placed on the injured reserve list with a hamstring injury and it is unknown if he will return when first eligible, December 10 against the Texans.",Hamstring,I-R,SFO,CB
Adrian Colbert,Colbert is recovering from surgery for a broken thumb and his availability is in question for Week 12 against the Seawhawks.,Thumb,questionable,SFO,DB
C.J. Beathard,Beathard has a thumb injury and his availability against the Seahawks in Week 12 is clouded.,Thumb,questionable,SFO,QB
Raheem Mostert,Mostert is dealing with a shoulder injury and it is undetermined if he will participate in Week 12 against the Seahawks.,Shoulder,questionable,SFO,RB
Solomon Thomas,Thomas is sidelined with a low-grade MCL sprain and it is unknown if he will return against the Seahawks during Week 12.,Knee,questionable,SFO,DL
Aaron Lynch,Lynch has been absent from the lineup in the previous four games due to a calf injury and it is undetermined if he will return Week 12 against the Seahawks.,Calf,questionable,SFO,LB
George Kittle,Kittle missed the last game due to an ankle injury and it is unclear if he will play Week 12 against the Seahawks.,Ankle,questionable,SFO,TE
Elijah Lee,Lee was held out of the last game due to a knee injury and it is unknown if he will play against the Seahawks in Week 12.,Knee,questionable,SFO,LB
Tank Carradine,Carradine is on the IR/Designated for Return list due to a right high-ankle sprain and it is unknown if he will be activated November 26 against the Seahawks.,Ankle,I-R,SFO,DL
Jaquiski Tartt,Tartt is on the injured reserve list as he suffered a broken forearm.,Forearm,I-R,SFO,S
Cole Hikutini,Hikutini has been placed on the injured reserve list due to a knee injury.,Knee,I-R,SFO,TE
Trent Taylor,Taylor suffered a broken rib and will miss an undetermined length of time.,Ribs,out,SFO,WR
Pierre Garcon,Garcon suffered a neck injury and is on the injured reserve list.,Neck,I-R,SFO,WR
Donavin Newsom,Newsom has been diagnosed with a concussion and is on the injured reserve list.,Concussion,I-R,SFO,LB
Chanceller James,James is on injured reserve with a knee injury.,Knee,I-R,SFO,S
Malcolm Smith,Smith sustained a torn pectoral muscle and is on the injured reserve list.,Pectoral,I-R,SFO,LB
Jimmie Gilbert,Gilbert has been placed on injured reserve due to a torn ACL.,Knee,I-R,SFO,LB
Stevie Tu'ikolovatu,Tu'ikolovatu has been placed on the injured reserve with an injured MCL and meniscus in his right knee.,Knee,I-R,TAM,DT
DaVonte Lambert,Lambert has been placed on the injured reserve with a dislocated wrist.,Wrist,I-R,TAM,DL
Noah Spence,Spence is on injured reserve due to a torn labrum in his shoulder.,Shoulder,I-R,TAM,DE
Nick Folk,Folk has been placed on the injured reserve list due to tendinitis in his plant leg.,Leg,I-R,TAM,K
J.R. Sweezy,Sweezy is hampered by a knee injury but is expected to be available Sunday against the Dolphins.,Knee,probable,TAM,G
Donovan Smith,Smith is expected to suit up against the Dolphins on Sunday despite a knee injury.,Knee,probable,TAM,T
Vernon Hargreaves,Hargreaves exited the last game due to a hamstring injury and will not play Sunday against the Dolphins.,Hamstring,out,TAM,CB
Robert Ayers,Ayers is dealing with injuries to his ankle and calf but is expected to be available for Sunday's game against the Dolphins.,Ankle,probable,TAM,DE
Gerald McCoy,McCoy is nursing injuries to his shoulder and back bu is expected to play against the Dolphins on Sunday.,Shoulder,probable,TAM,DT
Demar Dotson,Dotson will likely partake in Sunday's contest against the Dolphins despite a hamstring injury.,Hamstring,probable,TAM,T
Robert McClain,McClain missed the previous game due to a hamstring injury but is likely to play against the Dolphins on Sunday.,Hamstring,probable,TAM,CB
William Gholston,Gholston was held out of the previous game due to a neck injury and will not play against the Dolphins on Sunday.,Neck,out,TAM,DE
Jameis Winston,Winston aggravated his previous right shoulder injury is expected to miss multiple weeks of game action.,Shoulder,out,TAM,QB
Justin Trattou,Trattou has landed on the injured reserve list with an unspecified ailment.,Undisclosed,I-R,TAM,DE
Su'a Cravens,Cravens had offseason surgery to trim the meniscus in his knee and is on the Injured Reserve/Left Squad list.,Knee,I-R,WAS,S
Phil Taylor,Taylor Sr. has a quadriceps injury and is on the injured reserve list.,Quadricep,I-R,WAS,DL
Mason Foster,Foster has been placed on injured reserve due to a torn labrum in his shoulder.,Shoulder,I-R,WAS,LB
Jonathan Allen,Allen has been designated for the injured reserve list due to a lisfranc sprain in his foot.,Foot,I-R,WAS,DL
Dustin Hopkins,Hipkins has landed on the injured reserve list due to a right hip rotator muscle sprain.,Hip,I-R,WAS,K
Quinton Dunbar,Dunbar has an illness and his status is uncertain against the Saints on Sunday.,Illness,questionable,WAS,CB
Matthew Ioannidis,Ioannidis had surgery to repair a fractured fourth metacarpal in his hand and it is unknown if he will return Sunday against the Saints.,Hand,questionable,WAS,DL
Terrelle Pryor,Pryor Sr. will not be available Sunday against the Saints due to a foot injury.,Foot,out,WAS,WR
Spencer Long,Long is hampered by injuries to both knees and will not play against the Saints on Sunday.,Knee,out,WAS,C
Jordan Reed,Reed has been held out of the previous two games with a hamstring injury and will not be ready to return against the Saints on Sunday.,Hamstring,out,WAS,TE
Ty Nsekhe,Nsekhe is bothered by a core muscle injury and it is unknown if it will obstruct his availability against the Saints on Sunday.,Abdominal,questionable,WAS,T
T.J. Clemmings,Clemmings is on the injured reserve with an ankle injury.,Ankle,I-R,WAS,T
Zach Brown,Brown is dealing with a right Achilles injury and his availability against the Saints on Sunday is undecided.,Achilles,questionable,WAS,LB
Shawn Lauvao,Lauvao is battling a stinger and it is uncertain if he will take part in Sunday's matchup against the Saints.,Stinger,questionable,WAS,G
Anthony Lanier,Lanier is nursing a knee injury and it is uncertain if he will be a participant in Sunday's contest against the Saints.,Knee,questionable,WAS,DL
Trent Williams,Williams has a knee injury and it is unclear if he will be available against the Saints on Sunday.,Knee,questionable,WAS,T
Brandon Scherff,Scherff is bothered by a knee injury and his availability against the Saints on Sunday is undecided.,Knee,questionable,WAS,G
Brian Quick,Quick is going through the league-mandated concussion protocol and it is unclear if he will be cleared in time for Sunday's game against the Saints.,Concussion,questionable,WAS,WR
Niles Paul,Paul missed his second-straight game with a concussion and it is unknown if he will be available for Sunday's matchup against the Saints.,Concussion,questionable,WAS,TE
William Compton,Compton has been placed on the injured reserve list with a Lisfranc sprain in his foot.,Foot,I-R,WAS,LB
Montae Nicholson,Nicholson missed his second-consecutive game with an injured shoulder and his availability against the Saints on Sunday is up in the air.,Shoulder,questionable,WAS,S
Robert Kelley,Kelley has landed on the injured reserve list due to a high-ankle sprain and a sprained MCL.,Ankle,I-R,WAS,RB
DeAngelo Hall,Hall suffered a bone bruise in his knee during the last game and it is uncertain if he will suit up against the Saints on Sunday.,Knee,questionable,WAS,S
Ryan Grant,Grant exited the previous game to be evaluated for a concussion and it is unclear if he will play Sunday against the Saints.,Concussion,questionable,WAS,WR
Arthur Jones,Jones is on injured reserve with a shoulder injury.,Shoulder,I-R,WAS,DL
Kevin Bowen,Bowen is on injured reserve with a left ankle injury.,Ankle,I-R,WAS,T
Trent Murphy,Murphy suffered an ACL and MLC tear and will spend the entire 2017 season on the injured reserve list.,Knee,I-R,WAS,LB
Keith Marshall,Marshall has been placed on injured reserve after having surgery to repair a torn right patellar tendon.,Knee,I-R,WAS,RB
