Chris Jones,Jones is dealing with an unspecified injury and is on injured reserve.,Undisclosed,I-R,SFO,DL
Donavin Newsom,Newsom has been diagnosed with a concussion and is on the injured reserve list.,Concussion,I-R,SFO,LB
Chanceller James,James is on injured reserve with a knee injury.,Knee,I-R,SFO,S
Malcolm Smith,Smith sustained a torn pectoral muscle and is on the injured reserve list.,Pectoral,I-R,SFO,LB
Eli Harold,Harold is dealing with a concussion and his status going forward is week-to-week.,Concussion,out,SFO,LB
Jimmie Gilbert,Gilbert has been placed on injured reserve due to a torn ACL.,Knee,I-R,SFO,LB
BJ Johnson,Johnson has been designated for the injured reserve list due to a hamstring injury.,Hamstring,I-R,SFO,WR
Gerald McCoy,"McCoy is nursing a groin injury, leaving his status for Week 2 against the Bears unclear.",Groin,questionable,TAM,DT
Jacquies Smith,Smith is recovering from ACL surgery and his status for the regular season opener against the Bears is unclear.,Knee,questionable,TAM,DE
Brent Grimes,Grimes sustained a laceration to his lower leg and needed stitches to close the wound but is expected to suit up for the regular season opener against the Bears.,Leg,probable,TAM,CB
Ryan Griffin,Griffin has been placed on the injured reserve list due to a sprained AC joint in his shoulder and it is unclear if he will play Week 9 against the Saints.,Shoulder,I-R,TAM,QB
DaVonte Lambert,Lambert has been placed on the injured reserve with a dislocated wrist.,Wrist,I-R,TAM,DL
Stevie Tu'ikolovatu,Tu'ikolovatu has been placed on the injured reserve with an injured MCL and meniscus in his right knee.,Knee,I-R,TAM,DT
Doug Martin,Martin will miss the first three weeks of the 2017 season as his suspension from the end of the 2016 campaign for violating the league's PED policy will carry over.,Suspension,out,TAM,RB
Justin Trattou,Trattou has landed on the injured reserve list with an unspecified ailment.,Undisclosed,I-R,TAM,DE
Jamison Crowder,Crowder is dealing with a hip injury but is expected to participate in Sunday's game against the Eagles.,Hip,probable,WAS,WR
Ryan Anderson,Anderson is nursing a stinger and it is unknown if he will play against the Eagles on Sunday.,Stinger,questionable,WAS,LB
Spencer Long,Long underwent a knee scope but is expected to be ready for the season opener against the Eagles.,Knee,probable,WAS,C
Phil Taylor,Taylor Sr. has a quadriceps injury and is on the injured reserve list.,Quadricep,I-R,WAS,DL
Su'a Cravens,Cravens had offseason surgery to trim the meniscus in his knee and is expected to be sideline for a month.,Knee,out,WAS,S
DeAngelo Hall,Hall is on the PUP list while recuperating from surgery to repair a torn ACL in his knee and it is unclear if he will be activated October 29 against the Cowboys.,Knee,I-R,WAS,S
Kevin Bowen,Bowen is on injured reserve with a left ankle injury.,Ankle,I-R,WAS,T
Trent Murphy,Murphy suffered an ACL and MLC tear and will spend the entire 2017 season on the injured reserve list.,Knee,I-R,WAS,LB
Keith Marshall,Marshall has been placed on injured reserve after having surgery to repair a torn right patellar tendon.,Knee,I-R,WAS,RB
